comp_name,href,memberid,price,pro_name
即墨市星珏服装厂,https://shop3454963062238.1688.com,b2b-3447327656193d6,¥165.00,2018秋冬新款Hazzys情侣款休闲圆领套头加绒连帽卫衣支持一件代发
深圳市宝安区学谦数码印花服装厂,https://shop1457542848269.1688.com,b2b-28225970806f92d,¥165.00,2019秋冬新款男士帽衫时尚欧美青少年个性字母大V连帽卫衣批发
青岛创客优品商贸有限公司,https://shop0530s12368s18.1688.com,b2b-35833512659c2b6,¥165.00,新款黄金绒套装 新品男女休闲 冬季刺绣连帽带帽加绒卫衣套装
张振业,https://zzy8050.1688.com,b2b-4292649552ba5c1,¥165.00,102034  A秋冬新款女款运动套装金丝绒卫衣长裤保暖
即墨市凯琳娜服装厂,https://korliner.1688.com,b2b-2706952164a0960,¥165.00,102027  A秋冬新款男女款加绒加厚运动套装长裤卫衣吸汗透气
石狮市裕承达服装店,https://ycd18750510262.1688.com,b2b-4179918343c148f,¥165.00,金丝绒卫衣套装男士冬季休闲连帽韩版休闲运动潮流青年长裤3件套
淮安经济技术开发区潮流试衣间服装加工厂,https://clsyj88.1688.com,b2b-1954356527,¥165.00,冬季高领套头学生加厚卫衣羽绒服保暖打底男装短款青年休闲外套潮
桐乡六力服饰有限公司,https://shop1406220773596.1688.com,b2b-2157569007,¥165.00,秋季卫衣男长袖T恤圆领针织衫T恤长袖体恤衫套头宽松大码卫衣打底
清河县久欣羊绒制品经销处,https://shop645162og70706.1688.com,b2b-33606705585757a,¥165.00,秋冬新款男毛衣开衫卫衣时尚潮流男士青年连帽开衫外套
清河县妙依羊绒制品经销处,https://shop1450877053614.1688.com,b2b-2750939256acbf8,¥165.00,秋冬新款男毛衣开衫卫衣时尚潮流男士青年连帽开衫外套
桐乡六力服饰有限公司,https://shop1420164694516.1688.com,b2b-2389720331,¥165.00,男士毛衣秋冬外套大码圆领卫衣男韩版潮流青年打底套头针织衫线衣
上犹县神域动漫服装厂,https://shop1478077874527.1688.com,b2b-2995251451bb7f5,¥165.00,绝地求生刺激战场衣服Ezio外套同款游戏吃鸡周边卫衣pubg衣服夹克
武汉市硚口区金刀兔动漫服饰商行,https://shop1444928460641.1688.com,b2b-2669339907dd575,¥165.00,舰队collection舰娘大和动漫周边男女纯棉卫衣外套春秋
深圳市宝安区石岩阿罗元素工作室,https://aluoluo.1688.com,b2b-3248693121b1f74,¥165.00,情侣款2019春秋新款法国刺绣小狐狸圆领宽松百搭套头卫衣 配胸针
丹阳市开发区文郁阁百货店,https://shop490j334286x30.1688.com,b2b-41625535500bfe2,¥165.21,【天天特价】高寒户外抗秋冬保暖抓绒衣男加厚开衫外套双面穿卫衣
仙游县枫亭雅馨百货店,https://shop113h17y900739.1688.com,b2b-22007327053566c98b,¥165.51,2018新款加绒加厚男士连帽韩版秋冬季外套男衣服运动休闲卫衣套装
丹阳市开发区淳春百货商行,https://shop0691083444561.1688.com,b2b-2200737925713aa143,¥165.60,女士抓绒衣女加厚摇粒绒外套男双面绒户外上衣开衫卫衣冲锋衣内胆
毕雪,https://jsnowjsnow.1688.com,jsnowjsnow,¥166.00,kongstyle 卫衣/马甲韩国官网 首尔东大门女装设计师19
深圳市宝安区新安珍尼丝外贸服饰商行,https://shop4109d2m4060m6.1688.com,b2b-33882431715b7f9,¥166.00,2019欧美外贸男士时尚长款棉衣大毛领棉衣迷彩男女棉服 情侣棉衣
上海美贝舒商贸有限公司,https://mbs3618.1688.com,b2b-2020902356,¥166.00,美团外卖工作衣马甲定制印logo字反光透气骑手安全风衣卫衣服装男
丹阳市云阳镇文清记百货商行,https://shop721d9m076o951.1688.com,b2b-2200727147359ad8ab,¥166.40,马克珍妮春装女童男童装儿童运动套装宝宝卫衣套装71255
广州市酷农贸易有限公司,https://cuneyt.1688.com,b2b-343661264049fdd,¥167.00,秋冬新款欧美风嘻哈街舞潮流宽松卫衣 黄色印条连帽套头卫衣潮男
泉州塞尔登电子商务有限公司,https://shop5154433k33171.1688.com,b2b-4276821907d160e,¥167.70,儿童装男童冬装套装2018新款金丝绒加绒加厚中大童衣服卫衣三件
泉州市洛江区马甲盛举鞋服店,https://shop7o7250404oh35.1688.com,b2b-41808906311dea3,¥168.00,运动套装男士短袖t恤胖子宽松夏季韩版潮流加肥加大码休闲2件夏装
温州市瓯海潘桥悦思丽苏服装店,https://shop6i640b34b6364.1688.com,b2b-3712715008856e9,¥168.00,男士时尚黑色圆领卫衣 前胸绣花钉珠 侧缝黑白针织拼接
上海莲升服饰有限公司,https://shop875b994ze7407.1688.com,b2b-35165305831f139,¥168.00,男士时尚黑色圆领卫衣 前胸绣花钉珠 侧缝黑白针织拼接
石狮市齐梁贸易有限公司,https://shop7046038758595.1688.com,b2b-3975102923b5bae,¥168.00,金丝绒三件套男休闲加绒加厚运动套装双面绒连帽韩版潮流卫衣8588
泉州市澳启纺织商贸有限公司,https://geweisidun.1688.com,b2b-289161332956197,¥168.00,一件代发18夏季新款男士运动套装夏季宽松短袖短裤裤卫衣T两件套
德兴市新岗山镇占才村星辉服装加工厂,https://shop5278s844a2614.1688.com,b2b-3943750707b400e,¥168.00,青少年加绒加厚金丝绒三件套男士休闲韩版宽松连帽卫衣套装男装
泉州市占豪服饰有限公司,https://shop3926l69n76937.1688.com,b2b-3370626076181bb,¥168.00,2018新款卫衣保暖加绒加厚厂家直销
杭州江干钭钟武服饰有限公司,https://shop49799c2l87628.1688.com,b2b-3680685826b37f5,¥168.00,hiphop嘻哈宽松卫衣全身方块字母T开衫连帽外套春秋男潮上衣
东莞市意潮服饰有限公司,https://shop1482207298363.1688.com,b2b-305537631047e0b,¥168.00,肥佬加大加肥秋季休闲套装提花舒适潮牌胖子大码休闲运动卫衣套装
三威龙(福建)服饰织造有限公司,https://sanweilong.1688.com,b2b-2585893217bb6ca,¥168.00,2018新款卫衣保暖加绒加厚厂家直销
桐乡市易腾服饰有限公司,https://makeyang1.1688.com,b2b-1668526724,¥168.00,男秋装上新纯羊毛衫男青年卫衣针织男士连帽纯色拉链韩版男式毛衣
深圳市龙岗区迈图户外用品商行,https://shop5618t46576749.1688.com,b2b-33982125680738c,¥168.00,极地火秋冬情侣抓绒衣拼接开衫保暖透气防风摇粒绒卫衣ZRY304
深圳市宝安区松岗海纳美服饰商行,https://shop721b78d847566.1688.com,b2b-38749732362f9b5,¥168.00,AB Herby潮牌 直销2018新上新欧美 秋冬连帽纯棉卫衣男82882203
莆田市城厢区心格日用百货店,https://shop3sr7770m16121.1688.com,b2b-2200754501298d4e5c,¥168.40,秋冬季男士连帽韩版潮流外套男学生衣服运动休闲加绒加厚卫衣套装
中山市德赛尔制衣厂,https://shop4035m847s7622.1688.com,b2b-3985271286c092b,¥168.50,订做鲨鱼皮软壳风衣 拉链开衫风衣 长袖卫衣 冲锋抓绒软壳衣男
石狮市飞赛狼池服装厂,https://feisailangchi.1688.com,b2b-3549950397d0c8b,¥169.00,2019新款男式休闲套装两件套男士外套男连帽加绒款运动服套装男
深圳市宝安区福永芭伦漫服装厂,https://shop3216s3y673031.1688.com,b2b-4135015667e46c5,¥169.00,欧美潮牌2018秋冬情侣装 off彩虹渐变箭头印花拉链连帽开衫外套男
通州区川姜镇大菠萝服饰商行,https://shop1488968731203.1688.com,b2b-318243625441596,¥169.00,2018秋冬新款韩国潮牌男女套头连帽青少年卫衣运动情侣款一件代发
广州派杰服饰有限公司,https://paijie168.1688.com,b2b-3431821429aac54,¥169.00,冬季新款大码冲锋衣男 女加绒加厚冲锋棉衣情侣防水户外登山服
广州市诚辉服装有限公司,https://nachuan1818.1688.com,wp888zhang,¥169.00,夹克男装2018秋冬新款时尚休闲青年外套男式连帽卫衣长袖拉链衫
成都旭信达贸易有限公司,https://shop8q6305f04b228.1688.com,b2b-22012710199545c32b,¥170.00,DAIWA达瓦 钓鱼卫衣男版 轻轻薄棉衣全棉保暖时尚秋冬季新款运动
石狮市卡尔格调商贸有限公司,https://kaergediao.1688.com,b2b-33364404141e816,¥170.00,2018年秋装新款男士休闲运动套装三件套水貂绒加绒加厚外套
昆山市玉山镇麦络奥服装厂,https://shop611km22701m79.1688.com,b2b-22007276572655c67d,¥170.00,18SS欧美新款OW OFF WHITE情侣宽松连帽薄款卫衣涂鸦
广州市简朴贸易有限公司,https://shop5642g457n7m35.1688.com,b2b-3835349959fe4c8,¥170.00,2019年春 潮牌TB经典款手袖四条杠条纹色织男女款灰蓝色长袖卫衣
昆山市玉山镇威风社服装厂,https://wfs666.1688.com,b2b-402711218130688,¥170.00,6485 卫衣套装连帽衣服春秋款休闲外套情侣两件套潮春季运动服
广州路蕾服饰有限公司,https://shop108414e6228p0.1688.com,b2b-4219461922ad6d3,¥170.00,2018秋冬新款韩版原宿风宽松休闲大码加绒加厚亮片老虎头卫衣外套
广州唐牛牛服饰有限公司,https://shop96pp4e9497556.1688.com,b2b-2200754972998a27ff,¥170.00,高品质日系潮牌迷彩鲨鱼情侣连帽卫衣大码拉链开衫外套速卖通
仙游县枫亭旭怀百货店,https://shop0065d0r673233.1688.com,b2b-220073310271698b2c,¥170.00,18纯棉男女童金丝绒保暖套装中小童加绒加厚法莱绒卫衣新款两件套
杭州东坑口服装有限公司,https://xu19810929.1688.com,xu19810929,¥170.00,休闲运动两件套 男士连帽拉链 加厚加绒保暖 套装 1.24
广州潮绅氏服装有限公司,https://shop9254z0q2560i2.1688.com,b2b-36254617061740d,¥170.00,2018国潮休闲运动嘻哈风宽松套头连帽卫衣棉服拼色反光夹棉卫衣男
普宁市景致服装经营部,https://shop963h491857n41.1688.com,b2b-423769725199687,¥170.00,运动套装男春秋2018新款中老年卫衣大码长袖休闲跑步运动服
石狮市阿联纳服装厂,https://shop1417020227697.1688.com,b2b-2331699848,¥170.00,冬季加厚连帽无袖马甲 纯色修身保暖长裤 卡通动物印花卫衣套装男
诸暨璐丽雯贸易有限公司,https://zjluliwen.1688.com,b2b-1845114325,¥170.00,NOAH彩虹渐变翅膀图案连帽卫衣加绒品质简约美潮帽衫情侣六叔同款
深圳市龙岗区捷云服饰商行,https://shop1415724304015.1688.com,b2b-2283671644,¥170.00,厂家直销2018秋冬青少年时尚斜字母刺绣加绒加厚金丝绒卫衣三件套
深圳市南山区轩逸风服饰商行,https://xuanyifengfushi.1688.com,b2b-2200386003,¥170.00,春秋新款男女可穿情侣卫衣套装 可爱小猫咪图案印花休闲两件套潮
杭州逸旭电子商务有限公司,https://shop1459528957764.1688.com,b2b-285001832156f16,¥170.00,18秋冬新款卫衣套装韩版休闲运动套装三件套潮流时尚加绒加厚外套
仙游县鲤城君晟日用百货店,https://shop99q0397786593.1688.com,b2b-2200738536277d90be,¥171.48,2018秋冬季男士韩版学生外套加绒加厚休闲开衫卫衣运动套装潮
润州区允之伟百货商行,https://shop8910oc1725608.1688.com,b2b-220055647600687967,¥172.66,加绒加厚卫衣连帽外套冬季加肥大号胖子男生拼接迷彩假两件宽松潮
莆田市秀屿区笏石开龙日用百货店,https://shop106359q1i5053.1688.com,b2b-2200798881345cef22,¥173.00,18纯棉男女童金丝绒保暖套装中小童加绒加厚法莱绒卫衣新款两件套
深圳市龙华区第六大街服装厂,https://diliudajie.1688.com,b2b-3329276637477ff,¥173.00,2018冬季新款男士韩版修身金丝绒套装时尚型男运动休闲连帽三件套
上海羽越时装有限公司,https://lokuintus.1688.com,b2b-2917787387d973e,¥173.00,A9051欧美春季大码宽松原创设计拼色卫衣潮bf男友风时尚卫衣批发
上海盛色服饰有限公司,https://shop3794527o45896.1688.com,b2b-384854451482de4,¥173.00,个性撞色宽松大码卫衣女春季2019欧美女装bf男友风圆领套头上衣女
即墨区禾童品服装厂,https://shop2542v61992614.1688.com,b2b-408761621252ff0,¥173.00,运动束脚休闲卫衣裤男拼接竖条小脚裤春秋款外套上衣两件套2019
深圳市宝安区有名小站服装商行,https://shop5f4733hv36434.1688.com,b2b-22007290723431064e,¥173.00,潮牌OFF WHITE方框线条开衫拉链卫衣 高品质男女长袖外套OS版型冬
深圳市宝安区原潮制衣厂,https://yuanchaofuzhuang.1688.com,b2b-3880316168e3fea,¥173.00,OFF泼墨星空烟花开衫外套WHITE OW潮流男女领衔男式男装休闲加绒
石狮市胜馨服装厂,https://shengxin.1688.com,b2b-2514406337,¥173.00,气质情侣装2018新款秋潮卫衣三件套跑步运动套装男女春秋KK-56971
高新区盛中誉百货经营部,https://shop8vz9z60040949.1688.com,b2b-418560607437dc3,¥173.60,春秋新款贵人克运动服套装男士加网透气加大码跑步运动卫衣裤外套
莆田市湄洲湾北岸经济开发区忠门博凯服饰商行,https://shop406638n530533.1688.com,b2b-220078824657647c36,¥174.00,运动服套装男2019春秋新款女卫衣三件套韩版情侣运动装潮
昆山市玉山镇迪帛特贸易商行,https://shop5p85826dd4610.1688.com,b2b-220123077506603a63,¥174.26,户外抓绒衣女加厚摇粒绒外套男双面绒女士上衣开衫卫衣冲锋衣内胆
丹阳市开发区世顺泽百货商行,https://shop2135q65495475.1688.com,b2b-2200727016345c8e80,¥174.44,户外抓绒衣女加厚摇粒绒外套男双面绒女士上衣开衫卫衣冲锋衣内胆
深圳市宝安区西乡潮势力服装厂,https://cxsupreme.1688.com,b2b-22007181184264bd32,¥175.00,外贸重工刺绣款欧美套头连帽卫衣加绒高品质精工版男女帽衫外套情
嘉善花莲服装网店,https://shop45647kh521901.1688.com,b2b-3889491914bdcdd,¥175.00,儿童卫衣马卡龙套装4月初出货粉色蓝色一套卫衣两件透气舒适男女
义乌市风语者户外野营用具有限公司,https://china9555.1688.com,china9555,¥175.00,2019阿拉曼酋长系列酋长狂徒卫衣冲锋衣外套户外战术外套披风
广州市柒多子贸易有限公司,https://qiduozi.1688.com,qiduozi,¥175.00,7多子品牌童装批发 卡通卫衣童外套 绣花小熊童装卫衣
义乌市丽妍日用品有限公司,https://shop5b061k3680653.1688.com,b2b-4134782292fe913,¥175.00,2018新款长袖空白连帽卫衣男加绒套头帽卫衣秋冬装纯色套头帽衫
东台市牛哥服饰有限公司,https://shop8588507h132y7.1688.com,b2b-4080578451e2185,¥175.00,军刀D9高端定织定染灰迷彩连帽卫衣户外运动休闲开衫针织帽衫外套
深圳市宝安区晨嘉鑫商贸商行,https://shop65946000pxp54.1688.com,b2b-220074155727518581,¥175.26,12秋季13青少年14休闲运动套装15男孩子两件套16初中学生17岁卫衣
丹阳市开发区丰达壹百货商行,https://shop248s659938o80.1688.com,b2b-220071409849875de5,¥175.57,春夏季中老年运动服套装短袖三件套男士休闲卫衣纯棉爸爸运动服
合肥帛农服装有限公司,https://bonong.1688.com,popvov,¥176.00,帛农蓝色连帽卫衣脱帽简单日系风格高点G-DIAN新款包邮BN506
深圳市罗湖区都市潮人服装加工厂,https://dushichaoren123.1688.com,b2b-284208543047270,¥176.00,2019【限价不低于128元】嘻哈潮牌拼色工装冲锋衣情侣风衣外套男
深圳金宝莉服饰有限公司,https://pollyrodin.1688.com,vtop168,¥176.00,卫衣女连帽2018早秋新款韩版宽松学生慵懒松垮垮长袖字母拼接外套
石狮市登盈龙服装商行,https://shop51454ps0107p1.1688.com,b2b-3956089284c3f87,¥176.00,男式休闲学生加厚款韩版三件套装冬季运动服学生男卫衣连帽学生
泉州随风漫步鞋服有限公司,https://shop8g875949l4126.1688.com,b2b-4059958270c8219,¥178.00,花花公子圆领套头卫衣男套装秋季男士休闲装青年韩版潮流一套衣服
上海意兴服装有限公司,https://yixingf2.1688.com,yixingf2,¥178.00,上海定做冬季户外长袖班服卫衣定制加厚加绒防寒服外套印制logo
AOP对外测试账号04,https://ffuucckk.1688.com,b2b-1624747073,¥179.00,春秋季纯色纯棉套头卫衣男简约白色情侣圆领运动宽松长袖男打底衫
扬州熊猫大侠玩具有限公司,https://shop5c7926b441520.1688.com,b2b-22007806874297f29f,¥180.00,2019夏季运动套装男短袖T恤卫衣短裤长裤纯棉跑步三件套P1
相城经济技术开发区大雅韵服装店,https://shop32s7n962h1747.1688.com,b2b-2200696391530e8376,¥180.00,fear of god fog第六季6th植绒刺绣字母fg奶白色高领卫衣帽衫套头
杭州印蝶贸易有限公司,https://a118shop.1688.com,b2b-4029360480a8989,¥180.00,2019春季新款套装韩版印花撞色青少年运动连帽卫衣BT117
深圳市宝安区沙井艾克妮妮服装厂,https://kenzo88.1688.com,b2b-29880329392b81f,¥180.00,19早春新款老虎头刺绣圆领长袖卫衣现货微商一件代发
吴兴织里梦蒂制衣厂,https://shop1x13156754i49.1688.com,b2b-4002345325d52fe,¥180.00,火爆款新款儿童加绒高领冬男女宝卡通小黄鸭保暖卫衣热卖促销
甘井子区营城子街道风起云涌箱包经销部,https://shop1441126524937.1688.com,b2b-2636367193ff1d9,¥180.00,出欧洲老鼠货原单BUR平织高密棉扛机洗不掉色不变形男士圆领长袖
清河县眀骏羊绒制品厂,https://shop1378400061643.1688.com,b2b-1801098159,¥180.00,羊绒衫男帽衫春秋卫衣男套头 宽松韩版 秋季新款针织衫毛衣男连帽
上海衣页信息科技有限公司,https://matchu.1688.com,b2b-40086154668bb0f,¥180.00,团体定制 薄款拉链卫衣 刺绣印花logo
清河县好聚羊绒制品经销处,https://shop374a02b938207.1688.com,b2b-34131351144717b,¥180.00,秋冬新款男士连帽冒领羊毛衫长袖套头保暖卫衣宽松打底衫
深圳市罗湖区佳芙恩服饰店,https://shop1484845219225.1688.com,b2b-3110684533917e4,¥180.00,外单 涂鸦票根印花圆领运动卫衣 原单
广州市荔湾区赤之猿服装店,https://redmonkey2006.1688.com,redmonkey2006,¥180.00,刺绣卫衣/出口原单中国风刺绣棉衣/刺青纹身/厂家直销龙款3310
王宝成,https://www.1688.com/company/detail/wanglvchunfeng.html?fromSite=company_site,wanglvchunfeng,¥180.00,外贸原单2017新秋款男士连帽卫衣
常山县天明服装商行,https://shop70358537357x8.1688.com,b2b-2200778223527dae11,¥181.00,薄款男士立领夹克男纯棉运动服立领棒球衣棒球服男休闲运动外套
义乌市又心电子商务商行,https://shop0b905220g9748.1688.com,b2b-22007951343395872f,¥182.00,春秋款运动服套装男加网透气加肥大码防泼水两件套跑步卫衣
永城市东城区秋多服装店,https://shop6n45h6394n338.1688.com,b2b-4290919765387b8,¥182.20,卫衣套装秋季连帽男士衣服秋冬款休闲装外套冬季加绒加厚潮运动服
润州区云之浩百货商行,https://shop186182no4n914.1688.com,b2b-2200725713869ce518,¥183.00,韩国三口新款冬季加绒加厚修身一家天鹅绒刺绣连帽卫衣运动套装
丹阳市开发区弘文泰百货店,https://shop6p41p34187729.1688.com,b2b-2200734433043373dd,¥184.00,714street 16aw  蜡染 水洗做旧复古 重磅套头卫衣 男女同款 潮
昆山市玉山镇宇灵章百货商行,https://shop538993606d809.1688.com,b2b-220074213085690baa,¥185.00,白日梦纯棉T恤卫衣DIY个性定制班服团体DREAMER高端想家
东莞市厚街辉哥服装店,https://shop78b01k72m5100.1688.com,b2b-22005406434333ccb5,¥185.00,工厂直销原B家2019早春新款刺绣平织翻面绒卫衣舒适透气商务套头
佛山市雷神户外体育用品有限公司,https://leishenhuwai.1688.com,b2b-3686793110bc148,¥185.00,酋长狂途卫衣
慈溪晟汇贸易有限公司,https://freamve.1688.com,b2b-4173287324009ec,¥186.00,Freamve17BY标语印花褶皱简约套头连帽衫宽松潮男女情侣同款卫衣
重庆幺妹峰户外用品有限公司,https://shop65996f1439lk5.1688.com,b2b-3417289721ed042,¥186.20,北京森林户外旅行原创潮牌抓绒连帽休闲上衣宽松印花卫衣男女式
仙游县鲤南镇峰峦百货商行,https://shop6640b62842387.1688.com,b2b-2200716263667b9e90,¥186.48,羽绒马甲男加绒加厚三件套男装卫衣冬季韩版潮流帅气休闲运动套装
仙游县枫亭明莉百货店,https://shop28174x9o754j8.1688.com,b2b-2200733179359df9b8,¥186.82,2018新款秋季休闲运动套装男运动服服装跑步青年春秋两卫衣件套
上海尚晗商贸有限公司,https://shop1450285170730.1688.com,b2b-274649241187ce9,¥187.00,冲锋衣定制卫衣工作服印字logo防风防水加厚外套冬男女情侣登山服
泉州市秘森贸易有限公司,https://shop4i79366590171.1688.com,b2b-4074576810b35cf,¥187.06,2018新款男女情侣连帽休闲套装男卫衣加厚保暖运动装金丝绒三件套
深圳市南山区衣依爱美服装商行,https://shop1495299084192.1688.com,b2b-3295772455e32e8,¥188.00,运动套装男夏季新款潮短袖短裤运动服t恤卫衣短裤休闲套装两件套
桐乡市屠甸阿依莉服装网店,https://shop4011543m23815.1688.com,b2b-4209526628622cd,¥188.00,2018新款秋季皮夹克男机车皮衣中年外套棒球服潮夹克男装PU皮上衣
上海芊源服饰有限公司,https://shop3h78551jw5991.1688.com,b2b-220054890321454d89,¥188.00,网红童装货源 小红书  韩国童装gg7秋冬季男款卫衣
揭阳市揭东区新亨古苏服装批发部,https://shop1479486sw4630.1688.com,b2b-406192061488347,¥188.00,假两件卫衣男秋冬季加绒港风bf高领连帽潮流宽松原宿风加厚上衣男
石狮市铎晋服装厂,https://shop0u12p36f62366.1688.com,b2b-3894703165d7463,¥188.00,2018新款运动套装男冬季金丝绒三件套男士宽松卫衣韩版休闲运动服
深圳市宝安区西乡馨雅衣橱服装商行,https://shop37a1512692gt2.1688.com,b2b-360624563051567,¥188.00,恒源祥2018新款青年男式纯色连帽羊绒卫衣2018冬新款加厚羊毛衫
天津佳仕琪服装有限公司,https://jiashiqifushi.1688.com,coolmeninc,¥188.00,佳仕琪 毛线圈纯棉 春秋卫衣 波点男女款青年套头连帽卫衣 DOT帽
东莞市宇众服饰有限公司,https://dgyuzhong.1688.com,b2b-2517592370,¥188.00,2018秋季男士中国风休闲套装 龙袍刺绣连帽卫衣+时尚束脚运动长裤
深圳市甜欣旺贸易有限公司,https://shop1377624204442.1688.com,chensuxion,¥188.00,衣图纳运动套装男春秋季大码休闲长袖卫衣训练跑步健身开衫运动服
上海佰道溪实业有限公司,https://baidaoxifushi.1688.com,b2b-1114824047,¥188.00,韩版秋冬学生加绒棒球服大码情侣装卫衣工作班服定制外套男女工服
苍南县古哩古服饰厂,https://guligu.1688.com,b2b-38252777234520e,¥189.00,韩版男女童卫衣加绒双面绒18秋冬儿童中大童长袖套头套装一件代发
深圳市龙岗区维邦食品商行,https://shop0i89333105wm8.1688.com,b2b-3551958467036e6,¥189.50,逢2箱快递包邮中储粮俏厨食用调和油22L分提中熔点烹调油弹丸滋地
深圳市光明新区冰麟城夏贸易商行,https://shop4oj209028u238.1688.com,b2b-415630985623e93,¥189.55,男童卫衣运动套装儿童2018时尚帅气两件套宝宝韩版春款洋气潮裤子
润州区举之挂百货商行,https://shop26y178t009153.1688.com,b2b-220077311074952f07,¥189.70,运动套装男2019春跑步卫衣卫裤连帽长裤秋季休闲服两件套
广州市展壹鹤贸易有限公司,https://18818849383.1688.com,b2b-317737937259b7d,¥190.00,潮牌菲利普普兰套装PP卫衣秋冬新款纯棉骷髅头印花烫钻时尚休闲裤
苏州钮森时装有限公司,https://okeiriku.1688.com,okeiriku,¥190.00,ins超火日系网红潮牌 NASA针织卫衣
广州喜龙服饰有限公司,https://healong100.1688.com,healong100,¥190.00,赫尔龙 定制棒球服比赛训练用衣长袖排扣拼布棒球服卫衣厂家直销
灵璧县尹集繁姿服饰经营部,https://shop8v9v7v6192144.1688.com,b2b-42482384799f7f6,¥190.00,男女式卫衣绒衫  精选进口水貂绒 进口印花浆料
广州市白云区松洲悍雷骑士摩配商行,https://rockbiker.1688.com,b2b-1895437279,¥190.00,ROCK BIKER赛车服卫衣 机车骑士休闲外套卫衣带护具防摔骑行服
广州市金鑫服饰有限公司,https://shop13710359429.1688.com,b2b-1714467181,¥190.00,长期销售定做中学生校服 日系中学校服定制正装校服加工厂 卫衣男
深圳市艾里高登服装有限公司,https://shop27k97988145w0.1688.com,b2b-3309503719a3208,¥190.00,男士卫衣帽衫广告衫风衣印字加厚户外登山长袖冬季工作服源头厂家
晋江市金井镇盖拉多服装厂,https://shop270u87679i610.1688.com,b2b-3980558534fa0e3,¥191.47,卫衣男春秋款连帽运动套装休闲装青年运动服装秋季韩版潮流两件套
苍南县灵溪镇小马星座服装店,https://shop1423673011766.1688.com,b2b-2313375764,¥194.00,韩国 进口童装批发 2019年春男童长袖假两件韩版卫衣打底T恤0129
石狮市北津人服装厂,https://shop2m47911jj7696.1688.com,b2b-3372525736f6b3b,¥195.00,春秋季新款团购加绒加厚保暖男士运动套装韩版休闲金丝绒三件套潮
石家庄市军之风工贸有限公司,https://sjzjzf.1688.com,sjzjzf,¥195.00,正品17长袖体能训练服 春秋军迷户外运动服跑步健身夹克卫衣套装
义乌市泽才电子商务商行,https://zecaifushi.1688.com,b2b-282192483436e71,¥196.00,中通快递工作服冲锋衣薄款外套工装定制秋冬衣服订做男 印字logo
江苏奥辰商贸有限公司,https://shop8718e33984874.1688.com,b2b-42325167241fb61,¥320.00,巴黎风格摇粒绒国旗卫衣BLC高街风格潮人
平湖市钟埭街道辛迪之家服饰店,https://109342886.1688.com,b2b-3999331508320f6,¥320.00,原创潮牌男装GV新款鲨鱼牙齿帽衫连帽男女同款内里抓绒卫衣
深圳市南山区南油原丹服装厂,https://shop1458233007349.1688.com,b2b-2823350292d29b2,¥320.00,欧洲站2019秋冬季新款男士时尚玫瑰花装饰套头连帽卫衣宽松运动衫
杭州麦穗贸易有限公司,https://ffwm20150318.1688.com,b2b-339796883752574,¥325.00,2019新品情侣款oversize宽松男朋友风重工金箔丝线手绣圆领卫衣
