comp_name,href,memberid,price,pro_name
仙游县鲤城倾诚日用百货店,https://shop1fmk788676290.1688.com,b2b-2200731799258695d0,¥150.00,ins套装男帅气两件套嘻哈潮牌街舞一套衣服青少年卫衣外套hi
莆田市传福贸易有限公司,https://shop2u94296800691.1688.com,b2b-22005549574669e9fc,¥150.00,春秋装男外套连帽卫衣套装帅气百搭运动套装男士休闲运动服两件套
莆田市恭发贸易有限公司,https://shop9313r71560j82.1688.com,b2b-2200565396305f5b45,¥150.00,卫衣套装男士2019春秋韩版潮流休闲运动服青年连帽外套长袖两件套
台州瑞诺商贸有限公司,https://shop52800j4c33c20.1688.com,b2b-2201258912984de167,¥150.00,2018秋冬男式中国风刺绣连帽卫衣束脚小脚运动裤两件套大码套装潮
仙游县赖店明扬电器店,https://shop27gg3744c3257.1688.com,b2b-2200786487378363fb,¥150.00,男式休闲套装2019年春季新款韩版跑步运动服装运动连帽卫衣两件套
临漳县杜村集乡改娣家具网店,https://shop1h84gx0466686.1688.com,b2b-2201226867039d1a4f,¥150.00,10530#战地吉圃卫衣套装男春秋2018新款休闲运动服两件套男士套装
晋江市新塘梦佳制衣厂,https://shop45y969270i545.1688.com,b2b-220085018833648713,¥150.00,Jeep/吉普男卫衣秋冬款加绒长袖开衫卫衣男宽松休闲立领外套
莆田市蓝鹏贸易有限公司,https://shop8n271g3130384.1688.com,b2b-220060089509296bb9,¥150.00,南夏乔装 2019春款原创国潮印花假两件卫衣男宽松嘻哈街舞外套
莆田市荔城区九姐鞋服商行,https://shop021d728491p16.1688.com,b2b-22006011758009e541,¥150.00,2019新款男士春季休闲卫衣连帽套头上衣时尚潮流修身一件代发630
莆田市荔城区奇特真日用百货商行,https://shop78837617fg8w9.1688.com,b2b-2200726504041d8390,¥150.00,019新款男士经典白色印花卫衣-0035
武汉市江汉区利晟源服装店,https://shop48337ha956h64.1688.com,b2b-407951307473790,¥150.00,中老年人运动套装男春秋款中年爸爸装大码宽松外套休闲卫衣三件套
莆田市荔城区品优客日用百货商行,https://shop30a21g429y017.1688.com,b2b-220072634350699ea5,¥150.00,2019男士卫衣-0066
深圳市宝安区福永锦衣行服饰店,https://jeanshow.1688.com,b2b-22007847063158bf07,¥150.00,XL-8XL金丝绒三件套男长袖套装秋冬季休闲连帽卫衣男超柔加绒保暖
义乌市比颂电子商务有限公司,https://shop358r027k81878.1688.com,b2b-22005867103252982f,¥150.00,春季新款男式休闲套装韩版修身运动套装学生卫衣束脚裤两件套潮流
深圳市龙岗区豪坨百货商行,https://shop2740p35y866u4.1688.com,b2b-220074552091841da9,¥150.00,秋装青年t恤男士V领长袖薄款夏秋衣韩版潮流帅气卫衣春秋季上衣服
武汉舒点商贸有限公司,https://shop1462802909907.1688.com,b2b-2880231953c8368,¥150.00,情侣卫衣套装男春2019新款中青年时尚运动服三件套休闲运动套装男
北京夏亚林服装店,https://shop1395248216577.1688.com,b2b-2021828194,¥150.00,胖子卫衣套装男春季加肥加大7肥佬宽松外套290特大8连帽上衣潮
武汉市硚口区尚品衣格服装厂,https://shop1448988406497.1688.com,b2b-27325963834ae5e,¥150.00,中年运动套装男春秋2019新款男士立领卫衣两件套中老年休闲运动服
铅山县永平镇德霜服饰制衣厂,https://shop349t28gl26141.1688.com,b2b-4248600659d71c6,¥150.00,Yifsion|2019春装新款男士卫衣嘻哈套装潮流春季翻领外套两件套男
德兴市新岗山镇占才村占才桐乡服装厂,https://shop2d5h65z507923.1688.com,b2b-2200785460232a80c8,¥150.00,2019春装新款男士卫衣嘻哈套装潮流春季翻领外套两件套男
杭州思纯服饰有限公司,https://shop409b756618247.1688.com,b2b-38489930558ffe6,¥150.00,思纯|2019春装新款男士卫衣嘻哈套装潮流春季翻领外套两件套男
刘盛旗,https://shop35881mx394492.1688.com,b2b-42686290168cedc,¥150.00,2019春季新款男士套装 汤家纯棉毛圈纯色条纹情侣款卫衣卫裤套装
深圳市龙岗区纪元服装批发行,https://shop0sw79686u6390.1688.com,b2b-2200600277091d9f30,¥150.00,中老年人运动服套装男大码宽松卫衣三件套春季新款爸爸装运动套装
嘉兴寒豹服饰有限公司,https://shop943b24t933197.1688.com,b2b-4097754882d79b9,¥150.00,2019夏季中年男士短袖卫衣韩版休闲运动套装薄款圆领T恤两件套潮
武汉勇妮商贸有限公司,https://shop73183j2210x45.1688.com,b2b-2200733121039aa448,¥150.00,中年运动套装男春秋立领套头男士卫衣两件套中老年休闲运动服套装
天津市西青区壹久霸衣服装经营店,https://shop20985r4s1d760.1688.com,b2b-2200651118432673d8,¥150.00,欧美新款男式卫衣字母印花/印染套头普通款长袖时尚都市连帽领
武汉鑫速格贸易有限责任公司,https://shop79v529794qs73.1688.com,b2b-3931057461d7a1a,¥150.00,中老年人运动服套装男大码宽松卫衣三件套春季新款爸爸装运动套装
武汉市黄陂区盘龙城佳奕服装厂,https://shop1039255zh9936.1688.com,b2b-42354893029ee9a,¥150.00,中老年情侣运动套装2019春秋新款男运动服女休闲卫衣爸爸妈妈套装
李沧区艺乐买服装店,https://shop4891129122600.1688.com,b2b-4242574542140e9,¥150.00,春季新款男士圆领时尚休闲卫衣  货号  2115
武汉勇妮商贸有限公司,https://shop306460n8i02j4.1688.com,b2b-2200694184046d2ea4,¥150.00,运动服套装男春秋休闲卫衣男中年运动小脚裤男士春季外套三件套男
天门市衣加衣服饰,https://shop1411576961144.1688.com,b2b-2236773404,¥150.00,中年运动套装男春秋2019新款男士立领卫衣两件套中老年休闲运动服
德化优品汇电子商务有限公司,https://shop1jk9w33666730.1688.com,b2b-22006182050411c51b,¥150.00,卫衣套装男士连帽两件套休闲运动服韩版潮牌学生青年2019新款男款
深圳市龙岗区星语服装批发行,https://shop69886740247r9.1688.com,b2b-2200590316234b9bb4,¥150.00,男士连帽卫衣春款2019新款潮流中老年运动套装爸爸运动套装三件套
石狮市鑫诚联创服装有限公司,https://shop01p660y447871.1688.com,b2b-2200734042734a6c9e,¥150.00,两件套男士卫衣套装春秋运动套装男加肥大码休闲长袖开衫潮流宽松
杭州诚霖服饰有限公司,https://shop608o1927a6i61.1688.com,b2b-3854757344110a1,¥150.00,外贸男装2019春装新款男士卫衣嘻哈套装潮流春季翻领外套两件套男
泉州奋飞餐饮管理有限公司,https://shop6a1515a290796.1688.com,b2b-4193928230e4db9,¥150.00,2019春季新款卫衣男日系宽松街头潮流嘻哈外套青年连帽衫一件代发
深圳市宝安区沙井品衣客外贸服饰商行,https://pinyike.1688.com,b2b-3286519732435ef,¥150.00,0311 春夏拼色珠地网眼棉立领拉链卫衣！男士运动夹克开衫外套
武汉市黄陂区盘龙城子滢服装加工厂,https://shop3n2i40a668609.1688.com,b2b-4069938542500e3,¥150.00,运动套装男春秋爸爸装休闲运动服装男士卫衣大码三件套中老年人棉
天门市九真衣品汇服装,https://shop1375203449013.1688.com,b2b-1765228494,¥150.00,休闲运动套装男2019新款韩版时尚情侣装卫衣三件套女春秋运动服春
广州浩盛服装商行,https://shop999479584jl73.1688.com,b2b-2200606633616361d8,¥150.00,K3134 男装圆领长袖条纹休闲套头卫衣打底衫
铅山县永平镇德霖服饰制衣加工厂,https://shop0t3o665573i16.1688.com,b2b-2200724770465d9be1,¥150.00,Yifsion|2019春装新款男士卫衣嘻哈套装潮流春季翻领外套两件套男
石狮市中贵正服饰商行,https://xincheng97.1688.com,b2b-2855693773d293a,¥150.00,新款运动套装男春秋休闲装跑步运动服加肥大码宽松卫衣男士两件套
武汉市硚口区千姿伊人服装厂,https://shop1432898921042.1688.com,b2b-2546842418bv47a,¥150.00,2017春季新品中老年父亲爸爸运动服套装休闲跑步户外大码套头卫衣
锦江区日诚凡品服装设计工作室,https://hzcsfp.1688.com,b2b-34069078139664a,¥150.00,城市凡品 国潮原创高品质潮流街头嘻哈连帽卫衣男装日系一件代发
中山火炬开发区弟哥服饰商行,https://fsdg1983.1688.com,b2b-1660915637,¥150.00,中老年运动套装男春秋套头圆领运动服男士中年跑步服套装休闲卫衣
武汉红景芝服饰有限公司,https://shop1463659205649.1688.com,b2b-2890198979dc720,¥150.00,情侣运动套装男春装2019新款潮连帽卫衣休闲两件套时尚运动服男女
武汉中英尚品服饰有限公司,https://shop8y6r928958979.1688.com,b2b-2200694732715c51d5,¥150.00,2019新款时尚情侣套装连帽卫衣运动套装女春秋三件套休闲男运动服
深圳市晟路仕贸易有限公司,https://senlusy.1688.com,b2b-4061636185eb0dd,¥150.00,2019年春季新款潮牌复古中文印花男式连帽卫衣恶搞 一件定制批发
磐安县新渥镇依品阁服装店,https://paypgfzd.1688.com,b2b-3606185926d528a,¥150.00,Yifsion|2019春装新款男士卫衣嘻哈套装潮流春季翻领外套两件套男
武汉玉维丝服装有限公司,https://shop1440330675979.1688.com,b2b-2633081911e6321,¥150.00,情侣运动套装情侣装2019年新款春季休闲卫衣套装女运动服三件套男
莆田市城厢区陈盛贸易有限公司,https://shop17578263o1fd8.1688.com,b2b-34207152794d025,¥150.00,361度男装2018冬季新款套头卫衣361冬季印花百搭运动服男
杭州三笠贸易有限公司,https://996688.1688.com,b2b-3949375404c985e,¥150.00,Yifsion|2019春装新款男士卫衣嘻哈套装潮流春季翻领外套两件套男
深圳市宝安区蓝海红天服装批发商行,https://shop1489078432305.1688.com,b2b-316438109007f4a,¥150.00,春秋季休闲运动套装男中年爸爸装中老年男士三件套跑步运动服卫衣
昆山市玉山镇王可服装厂,https://wk123456.1688.com,b2b-3525314071b05f0,¥150.00,卫衣套装男秋季国潮大码宽松l连帽上衣男士中国风刺绣男外套
武汉市硚口区靓衣坊红遍天服装商行,https://shop805151750.1688.com,b2b-27662954972ee9a,¥150.00,2019春季男装三件套跑步运动套装韩版修身运动服春秋装卫衣休闲装
福州宝马服饰有限公司,https://fjbmfs.1688.com,fjbmfs,¥150.00,加绒连帽日系纯色卫衣男抓绒套头春秋冬款褂子潮牌中青年学生外套
广州市应本服装有限公司,https://shop1487397964737.1688.com,b2b-3168019515faea6,¥150.00,2019春秋新款潮流百搭连帽卫衣图案主推款双色时尚青年简约轻男
常熟市服装城杜小明服装店,https://shop1397494598993.1688.com,b2b-2056245855,¥150.00,2017男士运动开衫加绒青年上衣外衣卫衣长裤男印花815三件套
桐乡市濮院寒狼服装网店,https://shop70ql47a793584.1688.com,b2b-4258180616c3f87,¥150.00,2019春季新款连帽男式卫衣 时尚潮流薄款修身青年男士卫衣套装
杭州莒州网络科技有限公司,https://shop1456159951622.1688.com,b2b-2810893558d49e3,¥150.00,港风秋冬男獭兔毛连帽加厚开衫拉链卫衣毛毛绒外套情侣BF风男装
深圳市晟路仕贸易有限公司,https://senlusy.1688.com,b2b-4061636185eb0dd,¥150.00,2019年春季新款潮牌复古中文印花男式连帽卫衣恶搞 一件定制批发
义乌市洛野服饰厂,https://shop3h19909a52499.1688.com,b2b-33207283278a975,¥150.00,LUOYE洛野 2019春款日系胶印大字母连帽卫衣中性潮牌外套AC19009
冯帅,https://nanxiawaimao.1688.com,b2b-2168883097,¥150.00,南夏乔装 19新款高品质外套网红ins火同款潮流街头嘻哈连帽卫衣男
石狮市王宁服装厂,https://shop18y4593y488p0.1688.com,b2b-39415638937cdc4,¥150.00,厂家直销秋冬新款加绒加厚情侣长袖运动套装男大码卫套女连帽卫衣
杭州市滨江区潮外服装店,https://shop1428511750862.1688.com,b2b-2468623003,¥150.00,2019春装潮牌日系休闲外套百搭宽松套头男士连帽背后字母卫衣男
无锡梵卡森贸易有限公司,https://zhaiin.1688.com,b2b-2504857219,¥150.00,垂泽出品 19SS 日系高品质连帽卫衣男潮流街头嘻哈套头上衣-2色入
石狮市亿欣媛贸易有限公司,https://shop1456560520625.1688.com,b2b-2818037446eef54,¥150.00,2665冬季金丝绒休闲套装青年保暖三件套时尚男士运动套装加厚卫衣
杭州锦亭电子商务有限公司,https://shop265710bb21727.1688.com,b2b-41523201915d0aa,¥150.00,卫衣套装男13春秋季14长袖青少年15初中学生连帽16岁运动两件套潮
杭州小溪电子商务有限公司,https://shop28by821408600.1688.com,b2b-3586833002baaf9,¥150.00,挂拍中东2018新款加绒加厚连帽男装运动服休闲卫衣套装
石狮市新友仁欣服饰有限公司,https://shop8e5cw84449484.1688.com,b2b-220060322381449cd0,¥150.00,一件代发  金丝绒三件套装运动卫衣男士休闲装冬季加绒加厚秋冬款
石狮市小德淘服装厂,https://shop3z1567of12693.1688.com,b2b-341067282181aa6,¥150.00,2018男式休闲套装韩版时尚潮流运动金丝绒连帽卫衣加厚保暖三件套
杭州鸿彬网络科技有限公司,https://shop1455727632793.1688.com,b2b-27801219791db9c,¥150.00,2018冬季男士加绒加厚连帽卫衣套装 时尚保暖马甲+运动裤三件套
晋江市龙湖镇需寒问暖服装厂,https://shop30181374w9gx0.1688.com,b2b-399302827694c77,¥150.00,卫衣男士运动套装秋冬季2018新款潮男款连帽加绒加厚休闲运动服装
深圳市龙岗区汇力泰制衣厂,https://shop1433937847954.1688.com,b2b-2549503195pmovu,¥150.00,全棉加绒加厚男装卫衣高端大牌秋冬装开胸拉链连衣帽欧美潮流新款
即墨区千贝爱服饰店,https://shop5m09841371775.1688.com,b2b-4092765301deb75,¥150.00,2018新款男外套运动服防风夹克连帽卫衣跑步夹克跑步加绒外贸卫衣
深圳市福田区本色年华服装厂,https://bensenianhua.1688.com,b2b-34275972664913f,¥150.00,秋新款男士印花3D动漫海贼王路飞时尚连帽套头卫衣情侣速卖通套装
阜南县天宇电子商务有限公司,https://shop342p34533z160.1688.com,b2b-333429967848195,¥150.00,2018新款 JEEP/吉普连帽卫衣男加绒 秋冬直筒外套厚 开衫男装帽衫
林培芳,https://shop76636805q0yq1.1688.com,b2b-39316315824e158,¥150.00,男士卫衣套装加绒加厚衣服秋冬季2018新款韩版潮流运动男装三件套
海阳市团团服装商行,https://baokuan1717.1688.com,b2b-3968169525e0405,¥150.00,019现货2018年秋冬季新款经典时尚休闲简约百搭男士卫衣a01
即墨区蓝照辉服装厂,https://shop94agh80865147.1688.com,b2b-4148986497624ba,¥150.00,K家2018秋冬男士加绒套装卫衣圆领韩版贴身保暖不起球运动休闲
深圳市龙岗区衣纯绣服饰店,https://yichunxiu.1688.com,b2b-2049772491,¥150.00,2019冬装新款休闲运动服修身卫衣金丝绒套装男加绒加厚马甲三件套
深圳市南山区欣欣华丽服装厂,https://shop1450716925580.1688.com,b2b-2754409836b2003,¥150.00,欧美春秋潮流翅膀男卫衣纯棉圆领男女同款情侣装宽松潮流跨境货源
洛阳尚丹清风服饰有限公司,https://sdqf1688.1688.com,sdqf1688,¥150.00,5018冬季新款男装休闲卫衣加绒加厚双面绒两件套男运动保暖套装
石狮市芃树服装厂,https://pengshufuzhuan.1688.com,b2b-3876497367f14c1,¥150.00,男士卫衣秋冬金丝绒休闲两件套装青年男式加绒运动服时尚圆领男装
杭州诺狼电子商务有限公司,https://nanzhuang5188.1688.com,b2b-2214284675,¥150.00,2018秋冬装新款 男士运动套装 休闲韩版潮流连帽加绒加厚嘻哈卫衣
杭州傲达服饰有限公司,https://aodafushi666666.1688.com,b2b-4206058934fd3da,¥150.00,18日系新款套头金丝绒青少年套装卫衣加绒暴乱套头两件套男卫衣
宁波汉博文化传播有限公司,https://hanbbo.1688.com,b2b-28960749293c21b,¥150.00,W291【汉博】2018年秋季新款男装水貂绒印花图案保暖卫衣
苏州塞斯维尔服饰有限公司,https://shop92d4920d45142.1688.com,b2b-4216904102a76d8,¥150.00,金丝绒套装男士运动休闲装冬季外套加绒加厚卫衣男秋冬款衣服冬装
石狮市哈登服装厂,https://shop6219hd1193442.1688.com,b2b-411983888893a4e,¥150.00,2018秋冬新款潮流男休闲双面绒卫衣加绒加厚两件套男运动保暖套装
昆山市玉山镇传奇衣都服装厂,https://chuanqiyidu.1688.com,b2b-28783100734380e,¥150.00,冬季三件套运动套装连帽宽松卫衣棉马甲男装休闲学生加绒潮流外套
深圳市龙岗区辉煌伊秀服饰商行,https://shop1426611196969.1688.com,b2b-2459923046,¥150.00,花公子冬季加绒加厚长袖t恤男圆领纯色保暖卫衣中青年男装打底衫
杭州天缇服饰有限公司,https://shop0512d72724483.1688.com,b2b-34620483412708d,¥150.00,2019冬款加绒日系复古龙刺绣青少年连帽宽松男士时尚潮流卫衣套装
义乌市追梦服装厂,https://shop1n34p93475174.1688.com,b2b-42249847746d3bd,¥150.00,2018冬季 双面绒卫衣套装男士外套连帽衫三件套运动服
赵跃进,https://shop1451926400891.1688.com,b2b-27659778525a18d,¥150.00,秋冬金丝绒卫衣套装男连帽休闲卫衣韩版三件套运动服男14-15-16岁
深圳市龙岗区后述单品服饰商行,https://shop5462pa6813415.1688.com,b2b-4157842464eeb08,¥150.00,男式套装秋冬新款韩版卫衣潮流休闲套装时尚运动套装男 280
晋江市永和镇启明星服装厂,https://shop169e84t8751n1.1688.com,b2b-385545393906c04,¥150.00,秋冬季新款圆领套头运动套装加肥加大运动服休闲卫衣L-8X厂家直销
石狮市埃弗服饰商行,https://aidemeng.1688.com,b2b-290144007748088,¥150.00,XL-8XL金丝绒三件套男长袖套装秋冬季休闲连帽卫衣男超柔加绒保暖
即墨市杰瑞米服装厂,https://shop1487238571252.1688.com,b2b-31604942088c52b,¥150.00,18哈吉斯男士秋冬季新款英伦时尚卡通卫衣
石狮市聚达服装贸易商行,https://shop1br20434h6266.1688.com,b2b-4028395654bda8b,¥150.00,加绒加厚款纯棉男士休闲卫衣套装 一件代发
石狮市跨客服装厂,https://shop7tph535431380.1688.com,b2b-33727143258379e,¥150.00,加绒加厚款纯棉男士休闲卫衣套装 批发一件代发
深圳市福田区巴坦木服装厂,https://shop1142c010o4573.1688.com,b2b-344632928835436,¥150.00,抽象泼墨涂鸦男士加绒连帽卫衣宽松大码帽衫
杭州萧山云希服饰商行,https://lalala0571.1688.com,lalala0571,¥150.00,秋季ins卫衣套头立领夹克女宽松嘻哈冲锋衣男潮牌hiphop外套情侣
南和县萱锌商贸有限责任公司,https://shop156733uh78091.1688.com,b2b-3329263762b251e,¥150.00,色彩撞色连帽卫衣 18秋新款青年印花套头卫衣男士
石狮市日豪服饰贸易有限公司,https://mulinshan.1688.com,b2b-1727457680,¥150.00,金丝绒卫衣套装男装三件套冬季连帽加绒加厚韩版休闲运动秋冬外套
广州市众汇服饰有限公司,https://laibaiyefushi.1688.com,b2b-342750341267eef,¥150.00,夹克男潮流韩版个性织带拼接外套潮牌绣花卫衣男6965【新款控价】
杭州雅虹服饰有限公司,https://cxyhfsyxgs.1688.com,b2b-38591867475d4b3,¥150.00,AR男装|2018秋冬新款绣花撞色连帽套头卫衣AW107-P120 白底日系
常熟市虞山镇莫城鼎雄制衣厂,https://baoluonanzhuang.1688.com,b2b-2844749933d1bc0,¥150.00,2018新款大码男宽松休闲秋款透气帽衫加大胖子套头迷彩连帽新卫衣
杭州火铭网络科技有限公司,https://shop94350586c7634.1688.com,b2b-3899332867ff231,¥150.00,男式卫衣三件套装 2018秋冬新款 韩版男士时尚连帽衫三件套运动服
佛山市祺山商贸有限公司,https://shop024tv54351597.1688.com,b2b-408911620420d53,¥150.00,D家18杜嘉班男士秋冬新款满幅印花图案连帽套头休闲卫衣男女同款
北京乐尚子衿贸易有限公司,https://shop1472566760481.1688.com,b2b-297984144900cfd,¥150.00,JEEP 2018秋季新款男士开衫连帽时尚休闲卫衣棉质男士上衣JK0045
深圳市龙华区米森服装商行,https://shop531v11n3471h3.1688.com,b2b-33799081776579f,¥150.00,2018秋冬新品男士长袖T恤圆领套头修身青年卫衣时尚休闲打底卫衣
深圳市南山区月月隆服装厂,https://yueyuelongfs.1688.com,b2b-27644508110335b,¥150.00,热卖运动套装卫衣新款男装加绒加厚套装冬季休闲套装三件套男批发
武汉俏衣橱商贸有限公司,https://shop1489472931014.1688.com,b2b-286395705327b6d,¥150.00,运动套装男秋中老年爸爸装长袖连帽卫衣宽松大码休闲三件套装纯棉
深圳市龙岗区伯爵英伦服装厂,https://bojueqishi.1688.com,b2b-2959141374d2e15,¥150.00,断码清仓 不退不换 新款卫衣男春秋丝光棉麻套男士休闲装运动套装
杭州几道服饰有限公司,https://hzjdfs.1688.com,b2b-3434412946173b7,¥150.00,卫衣套装男秋季国潮大码宽松l连帽上衣男士中国风刺绣男外套
深圳市福田区英皇奥伦服饰商行,https://yinhuang.1688.com,b2b-26542455113dcd7,¥150.00,秋季卫衣套装潮流学生帅气学生青少年字母印花条纹休闲运动服潮牌
南阳迈美迪娅商贸有限公司,https://15539991816.1688.com,b2b-393553605899050,¥150.00,卫衣男连帽套头休闲套装男士时尚外套卫衣套装运动套装男潮跑步服
东莞市宇晨服饰有限公司,https://active1688.1688.com,b2b-2889660254ad2f0,¥150.00,厂家直销新款秋冬个性卫衣男 外套 时尚男款上衣 可定制 自定义
泉州市富宾思服饰有限公司,https://shop1456764684273.1688.com,b2b-2817354703aab6e,¥150.00,TAPOO踏普男士运动休闲套装男生新款金丝绒卫衣卫裤马甲三件套潮
武汉涛玲商贸有限公司,https://shop1442064891262.1688.com,b2b-2650023889f186f,¥150.00,情侣卫衣男士秋季套装2018新款休闲装女宽松韩版运动套装男春秋季
深圳市晟路仕贸易有限公司,https://senlusy.1688.com,b2b-4061636185eb0dd,¥150.00,2019年春季新款潮牌复古中文印花男式连帽卫衣恶搞 一件定制批发
莆田市荔城区星期二鞋服商行,https://www.1688.com/company/detail/b2b-22006013271508f326.html?fromSite=company_site,b2b-22006013271508f326,¥151.20,2019春季男士运动套装男春秋新款韩版男装长袖休闲潮流卫衣两件套
莆田市荔城区五哥鞋服商行,https://shop041532h775751.1688.com,b2b-220060055757881879,¥151.20,2018秋季新款卫衣男款 宽松韩版潮连帽套头卫衣 春秋款卫衣情侣装
西安市未央区艳思斐百货店,https://shop83k290s939301.1688.com,b2b-22006973442069369c,¥151.20,15初中学生13春季男孩开衫连帽卫衣14套装16青少年12一套衣服17岁
泉州创煦服饰有限公司,https://shop6i0844239l9l9.1688.com,b2b-4208777482e9238,¥151.47,春季运动服套装中老年休闲套装纯棉保暖爸爸装男式卫衣三件套装男
深圳市南山区久巨乐贸易商行,https://shop789g8g03018q8.1688.com,b2b-2200722377133181a4,¥151.49,2018春秋季新款青少年卫衣外套运动套装初中高中学生三件套装男潮
鹿邑县秀春日化店,https://shop922i8781q6x09.1688.com,b2b-220122974968009cd2,¥151.60,卫衣男连帽青少年休闲运动男士帅气春秋季新韩版潮流时尚纯色卫衣
仙游县枫亭康帅服装店,https://shop71z94569375e9.1688.com,b2b-22005619882602645c,¥151.96,卫衣T恤加绒中大童5儿童装冬装6男孩男童8岁加厚13小男孩冬天上衣
沛县殷晴日用品店,https://shop378b001m46199.1688.com,b2b-220078869489965061,¥152.00,春秋潮流个性休闲夹克外套男孩运动套装青少年初中学生卫衣两件套
杭州翔勃服饰有限公司,https://shop1456245708262.1688.com,b2b-278481173880f0c,¥152.00,日系春季新品宽松拼接男士情侣装卫衣男装连帽撞色潮外套一件批发
即墨区福小七服装商行,https://shop4i7l8v0628888.1688.com,b2b-220071621285426243,¥152.00,047现货2019新款立领卫衣休闲百搭男士外套a
石狮市源源富友服装厂,https://shop26907537u5s51.1688.com,b2b-3963404572a7d42,¥152.00,顶巨春秋季衣服男卫衣连帽韩版休闲运动金丝绒套装青少年两件套套
石狮市琼装服装厂,https://shop1467649947223.1688.com,b2b-2928220669a54b4,¥152.00,2018秋季新款男士长袖韩版圆领卫衣秋装打底衫衣服
杭州江干朱晨服饰有限公司,https://zjhzcongge.1688.com,zjhzcongge,¥152.00,儿童卫衣春 夏季可爱数字纯色女童上衣 男童长袖不连帽宝宝卫衣
杭州楷瑞电子商务有限公司,https://shop1476377238700.1688.com,b2b-301128885074584,¥152.00,19春季新款青少年宽松休闲日系连帽卫衣男装韩版时尚卫衣一件代发
石狮市芊雅依梦服装商行,https://shop18971n2w04126.1688.com,b2b-39697271353d722,¥152.00,秋季棉卫衣男式潮牌连帽衫ins新款休闲时尚字母印花宽松上衣代发
即墨区李佳佳服饰厂,https://shop60596143mia03.1688.com,b2b-42311359683000b,¥152.00,YS秋冬新款加绒保暖连帽运动时尚百搭男款连帽卫衣套装
石狮市独领亿阁服饰有限公司,https://shop1479293482119.1688.com,b2b-303773710845fac,¥152.00,男士卫衣套装套头秋冬款加绒加厚连帽休闲装运动服冬季潮流三件套
义乌市尚瑾电子商务商行,https://shangjinfushi.1688.com,b2b-392887892672b30,¥152.00,2018秋季金丝绒加厚日系宽松男生卫衣大码宽松印花潮流套装两件
晋江市新塘迈优服装商行,https://shop2486540082bj9.1688.com,b2b-4119302872ed917,¥152.00,外贸运动套装男秋冬新款加绒加厚连帽卫衣保暖休闲运动套装两件套
石狮市君圣之家服装厂,https://shop7s4f7j2220252.1688.com,b2b-38438824683a985,¥152.00,男士卫衣套装套头秋冬款加绒加厚连帽休闲装运动服冬季潮流三件套
深圳市龙岗区永兴梦琪百货商行,https://szyxmq.1688.com,b2b-42116367436946e,¥152.00,宝宝秋冬装套装男童婴儿童装0加绒1加厚2-3岁女儿童卫衣三件套潮
