comp_name,href,memberid,price,pro_name
丽水市悦妍婷贸易商行,https://shop4j58251a1b569.1688.com,b2b-2200798671392c6826,¥179.40,男士外套2019春季新款卫衣两件套休闲男装韩版潮流春秋款运动套装
深圳市柏元科技有限公司,https://shop1462986084542.1688.com,b2b-28838857246910b,¥179.40,骆驼户外18新秋季 综训圆领卫衣男运动套头休闲衣男8W1Y21007
丹阳市开发区万格维百货商行,https://shop1n1771l885i73.1688.com,b2b-2200789130229fd6c9,¥179.67,卫衣春秋男款保暖弹力户外空气层外套连帽卫衣开衫外套
沛县献玉百货商行,https://shop63205011w7a70.1688.com,b2b-40113588283d4b9,¥180.00,运动套装男秋冬加绒加厚连帽运动服套装冬季跑步休闲装两件套卫衣
仙游县鲤南镇凌清风百货商行,https://shop1a6283ky94528.1688.com,b2b-22007157788624bb70,¥180.00,情吕卫衣红色卫衣男学生韩版潮流戴帽子的上衣白色连帽衫加
石狮潮猎贸易有限公司,https://chaoliefuzhuang.1688.com,b2b-4053615479dd44c,¥180.00,品牌男春秋装户外运动休闲两件套长袖长裤开衫卫衣套装15628
杭州晨飘服饰有限公司,https://shop1400777643898.1688.com,b2b-2095952636,¥180.00,精品男青年大码运动套装秋季男士印花卫衣套装2018男生立领卫衣衫
郭运飞,https://shop1363803811268.1688.com,b2b-1614265547,¥180.00,精品男青年大码运动套装秋季男士印花卫衣套装2018男生立领卫衣衫
常熟市虞山镇大发服饰店,https://shop58018m0541183.1688.com,b2b-3663677407ef9c1,¥180.00,潮牌港风chic男士卫衣春夏款 ins超火的卫衣男潮宽松圆领套头外套
成都凡帝文服饰有限公司,https://shop761n4568t7627.1688.com,b2b-220061274219700325,¥180.00,长袖T恤2019年新款春季男纯棉帅气圆领卫衣
杭州宝逸服饰有限公司,https://shop4h235h42841i2.1688.com,b2b-424479893911d44,¥180.00,秋季男士长袖t恤男圆领大码打底衫潮流韩版修身青年加绒加厚卫衣
石狮市汀斯派服装厂,https://shop1457974128071.1688.com,b2b-2831141470ae9a8,¥180.00,2019春季款潮流休闲时尚运动卫衣男士运动修身套装青年三件套男装
杭州铭兴服饰有限公司,https://shop5262a3683k3h1.1688.com,b2b-4079192833d0c52,¥180.00,2018冬季新款男士三件套装运动卫衣金丝绒休闲男装加绒加厚衣服潮
石狮市魅惑潮服装厂,https://meihuochao.1688.com,b2b-36819213834f823,¥180.00,金丝绒三件套套装男装秋冬季韩版潮流休闲加绒男士卫衣套装外套
广州市荔湾区龚鸿服饰经营部,https://shop1474908087986.1688.com,b2b-29040395431c219,¥180.00,秋冬季新款男童套装 卫衣配打底裤休闲套装 烫钻潮流印花虎头套装
德兴市诚森制衣厂,https://shop98i22c48h4206.1688.com,b2b-41473270496ee3b,¥180.00,冬新款港风时尚金丝绒刺绣连帽运动服双面加绒休闲潮男卫衣三件套
深圳市汉博森服饰有限公司,https://hanboson.1688.com,b2b-2151491605,¥180.00,外贸男装连帽拉链开衫外套青年男士修身休闲卫衣夹克男潮
通州区金新凡涵服装厂,https://huangjiaoshou.1688.com,b2b-3532941656624e8,¥180.00,卫衣男秋季反光工装休闲外套运动大码卫衣两件套装春秋款潮流宽松
广州市增城名饰服装包装部,https://msyxjeans.1688.com,b2b-2130229316,¥180.00,2018秋装新款卫衣男连帽春秋休闲外套男士不起球秋季卫衣外套厂供
杭州奥亚服饰有限公司,https://shop2w1622m845072.1688.com,b2b-3481836478499aa,¥180.00,2018卫衣套装男士外套连帽衫三件套运动服韩版 一件代发
深圳市罗湖区佳成服装批发店,https://shop1364929030759.1688.com,b2b-1649516541,¥180.00,高端品牌春秋季节男装格纹卫衣  上衣宽松拼接休闲长袖现货
石狮市顺泰来福服装厂,https://shop698oi21i92903.1688.com,b2b-39572004054f983,¥180.00,春秋季新款男式立领外套运动休闲套装男加肥加大码青年卫衣中老年
石狮市卡尔吉尼服装厂,https://shop8755250e34748.1688.com,b2b-344674730039753,¥180.00,秋冬男士新款三件套休闲运动套装棉马甲保暖卫衣裤子男装连帽卫衣
石狮市联兴幻影服装商行,https://shop97687581503m6.1688.com,b2b-400166904194dd8,¥180.00,运动套装男韩版潮流三件套春秋季加绒卫衣外套学生帅气一套衣服
东莞市天达服饰有限公司,https://shop1482206425147.1688.com,b2b-30745777758ebec,¥180.00,TB THOM2018春秋季新款韩版潮流男士连帽卫衣长袖帽衫工厂批发
桐乡市濮院施颜服装网店,https://shop1461949107569.1688.com,b2b-287226826110df1,¥180.00,男装2018秋季新款男式休闲套装时尚韩版印花字母圆领卫衣加裤子
郭首乾,https://shop1369760787204.1688.com,b2b-1705446258,¥180.00,秋季商务男士大码运动卫衣套装 青年立领印花卫衣套装精品男卫衫
刘信信,https://chaorennanzhuangdian.1688.com,chaorennanzhuangdian,¥180.00,2018男装商务修身大码纯棉运动卫衣套装 男士精品立领印花卫衣
柳州诺旋贸易有限公司,https://ssfz2011.1688.com,ssfz2011,¥180.00,新款男式韩版开衫侧边拉链设计个性非主流男装卫衣外套休闲潮装
广州库盈贸易有限公司,https://shop1444901221305.1688.com,b2b-2564455791g99bw,¥180.00,外贸秋冬新款男士卫衣 连帽开衫卫衣男潮微销通一件代发LC038
莆田市秀屿区笏石珍妮弗日用百货店,https://shop5934058d6f844.1688.com,b2b-2200798423596af5c9,¥180.48,潮牌卫衣男连帽嘻哈情侣外套秋冬款带帽黑色潮流宽松学生加绒帽衫
深圳市龙岗区锦珍基贸易商行,https://shop279029620kq85.1688.com,b2b-22007366742324159a,¥180.60,8大童9男童秋天套装10一套11休闲12卫衣13儿童14秋季衣服男孩15。
西安市未央区海田天亿百货店,https://shop24359603zg743.1688.com,b2b-22012258835947b73f,¥180.70,春装大码男外套加肥加大连帽衫韩版宽松套头卫衣胖子男装
深圳市龙岗区招盈电子商务商行,https://shop4855v97849412.1688.com,b2b-420473720017fcc,¥181.49,。休闲潮冬季懒惰街头套头加绒加厚卫衣男冬厚秋冬连帽中长款套头
润州区凯亚洪贸易商行,https://shop015w222740305.1688.com,b2b-2200827364915853fb,¥181.87,男刺绣半袖卫衣连帽 春秋款韩版潮流19夏T恤套装外套男生短袖帽衫
常山牧子贸易有限公司,https://shop344925j037o09.1688.com,b2b-4284492461aa81e,¥182.00,春秋款运动服套装男加网透气加肥大码防泼水两件套跑步卫衣
衡阳大树电子商务有限公司,https://dadashu.1688.com,b2b-4265606542e9427,¥182.00,2019新款男士卫衣嘻哈套装潮流春季翻领夹克男外套两件套休闲男装
泉州尚隆贸易有限公司,https://shop1467801598703.1688.com,b2b-2921616559d352d,¥182.00,柯比登2018秋冬卫衣套装男士休闲运动三件套金丝绒加绒加厚外套男
深圳市宝安区斯内达尔服装商行,https://shop9q89393w473m9.1688.com,b2b-398076610412e70,¥182.00,2018韩版男士卫衣连帽衫时尚潮流薄款
深圳市光明区久如安贸易商行,https://shop416mc154m8662.1688.com,b2b-42741183384b384,¥182.20,中舍2018男士休闲运动春季套装青少年学生圆领韩版潮流卫衣时尚春
莆田市秀屿区笏石凯丝贝日用百货店,https://shop1084096z08652.1688.com,b2b-2201242986553c8b6a,¥182.40,三件套2018秋季新款男士帅气青少年卫衣休闲套装韩版潮流一套衣服
莆田市秀屿区埭头东新百胜日用品店,https://shop155i1q3e59804.1688.com,b2b-220081841488693899,¥182.40,三件套2018秋季新款男士帅气青少年卫衣休闲套装韩版潮流一套衣服
仙游县鲤南跃好百货店,https://shop8696418051127.1688.com,b2b-2200738684886bff8d,¥182.50,秋季卫衣套装男连帽春 chic早秋套装男韩版潮流  休闲装衣服
荣成市人和隆禄德贸易商行,https://shop522691t61v254.1688.com,b2b-22005719929110793f,¥182.58,加厚长袖t恤男卫衣中年男士加绒秋冬体恤圆领打底衫保暖衣服男装
润州区鑫之玲百货商行,https://shop54pq036348278.1688.com,b2b-425986931156416,¥182.60,运动套装男秋冬加绒加厚连帽运动服套装冬季跑步休闲装两件套卫衣
沭阳县庙头镇忠富百货销售中心,https://shop33404n4443143.1688.com,b2b-2200737356194e72eb,¥182.60,运动套装男秋冬加绒件套连帽运动服套装冬季跑步休闲装两加厚卫衣
深圳市光明区欣吉茂电子商行,https://shop344045l997096.1688.com,b2b-2200532203443ff6c8,¥182.99,。40男士穿的加厚秋冬季抓绒卫衣50岁中年爸爸装摇粒绒外套60运动
嘉兴圣阁服饰有限公司,https://shop713362096tff8.1688.com,b2b-3963343821943d7,¥183.00,卫衣套装冬季新款加绒加厚青年休闲套头圆领运动保暖男式卫衣批发
润州区召之来百货商行,https://shop9728837h25003.1688.com,b2b-4263980076e41cc,¥183.00,运动套装男秋冬加绒加厚连帽运动服套装冬季跑步休闲装两件套卫衣
即墨区艾露薇服装店,https://shop1072926367mn6.1688.com,b2b-4145272523fac35,¥183.00,TM1581 秋冬新款2018男士休闲连帽长袖卫衣套头印花纯色上衣
西安市长安区达达宏波百货经销部,https://shop525i0s3826012.1688.com,b2b-2200818626284437b2,¥183.05,春季纯色连帽卫衣男 日系男生宽松套头衫运动外套潮帽衫长袖上衣
深圳市龙岗区灿灿宝贝商贸商行,https://shop0lq34h8068696.1688.com,b2b-4114742636e7b0a,¥183.53,男童运动套装5秋冬装6小男孩7加绒加厚8卫衣两件套9岁12长袖衣服
莆田市秀屿区笏石珍妮弗日用百货店,https://shop4769v614813l1.1688.com,b2b-2200751173282f5adb,¥184.00,男士套装2019新款t恤一套休闲运动帅气白t长袖韩版潮流卫衣男衣服
厦门欣嘉佳贸易有限公司,https://shop441r34q491558.1688.com,b2b-2200577965030c1602,¥184.00,【中国新说唱】特步男子卫衣套头衫嘻哈卫衣2019春季982329051691
深圳市宝安区江淘淘贸易商行,https://shop2l7c85954pp76.1688.com,b2b-402903095477cb7,¥184.42,新款长袖t恤男秋装休闲圆领打底体桖衫男士帅气潮流卫衣男T中青年
深圳市南山区馨风尚服饰商行,https://xinfengshang666.1688.com,b2b-41266999786229f,¥184.60,2018秋冬新款加绒青少年男士连帽休闲卫衣加厚男套头卫衣
泗洪县潘贵想服装店,https://shop6205sc42227p9.1688.com,b2b-2200718082530ad600,¥185.00,加肥加大卫衣男连帽宽松休闲潮胖子肥佬外套男士套头长袖上衣批发
即墨区美烁烁服装厂,https://shop1085z8569a573.1688.com,b2b-2200786566116576e7,¥185.00,A家阿家男士运动休闲精致卫衣卫裤套装纯棉弹力棉
晋江市陈埭镇星河之家服装厂,https://shop0x2c64928l627.1688.com,b2b-22006354840668ff14,¥185.00,冬季男士卫衣潮加厚保暖秋装外套休闲运动三件套双面金丝绒套装
福州达讯贸易有限公司,https://shop262s884706934.1688.com,b2b-22005809895779269c,¥185.00,卫衣男潮流运动休闲 龙1
常熟邦度商贸有限公司,https://shop00uqq59139126.1688.com,b2b-3540393386c4b3b,¥185.00,外贸原单金丝绒套装男士运动休闲装冬季外套加绒加厚卫衣男秋冬款
石狮市青门缘服饰有限公司,https://shop1466010513025.1688.com,b2b-291264785708172,¥185.00,金丝绒卫衣男装韩版潮流套装加绒加厚保暖连帽三件套潮流韩版卫衣
石狮市摩纳哥户外用品商行,https://monage.1688.com,b2b-281090884365bb3,¥185.00,冬季男士加绒加厚羊羔绒套装加肥加大码运动两件套卫衣卫裤套装潮
石狮市动克保罗服饰贸易有限公司,https://dkpolo.1688.com,b2b-2171297409,¥185.00,冬季新款休闲男士套装金丝绒连帽加绒加厚三件套潮韩版卫衣保暖
杭州奔鹏服饰有限公司,https://shop78z1jz1357244.1688.com,b2b-3422767840ade1f,¥185.00,个性假两件卫衣带帽棒球服夹克衫 运动休闲带帽夹层棉衣外套男
刘丽方,https://shop1386694546439.1688.com,b2b-1900786838,¥185.00,2018冬季加绒套装金丝绒韩版运动休闲服男士卫衣三件套一件代发潮
义乌市佳运服装厂,https://shop6989u6910n938.1688.com,b2b-415222990890667,¥185.00,2018新款秋冬卫衣加绒加厚连帽运动休闲套装两件套运动服男士外套
石狮市君沉服装厂,https://shop401128j670809.1688.com,b2b-41763221208cc08,¥185.00,卫衣男士秋冬季套装韩版潮流金丝绒三件套帅气运动休闲套装
瑞安市起典服装厂,https://zhen1314.1688.com,b2b-407897940496e99,¥185.00,秋冬男士sup卫衣休闲裤套装侧边拼接小脚系带松紧腰字母脚运动裤
广州大条贸易有限公司,https://heyguys.1688.com,b2b-36320376577b706,¥185.00,男秋外套纯色宽松休闲上衣长袖重磅纯棉毛圈料卫衣拉链侧开叉卫衣
北京苇航商贸有限公司,https://shop04c1644932599.1688.com,b2b-3425500179f4606,¥185.00,Babyant高端童装2018秋冬新款男童卫衣中大童老虎绣花撞色帽衫潮
深圳市龙岗区耐剋鞋行,https://shop1467726711615.1688.com,b2b-2921920558efcfb,¥185.00,短袖t恤男2018新款个性圆领卫衣青少年学生百搭
石狮市淘爱贸易有限公司,https://taoaifs.1688.com,b2b-280997690019fd7,¥185.50,男士运动套装春秋长袖户外跑步运动服情侣运动衣两件套休闲卫衣男
昆山市玉山镇丰来润百货商行,https://shop36f8898763w57.1688.com,b2b-22007460010916712d,¥185.56,秋季套装男加肥纯棉休闲运动服宽松胖子加大加绒卫衣两件套200斤
昆山市玉山镇特雷扬百货商行,https://shop5894034uue889.1688.com,b2b-2200695609558224e4,¥185.56,秋季套装男加肥纯棉休闲运动服宽松胖子加大加绒卫衣两件套200斤
晋江市陈埭镇索亚纶服装厂,https://suoyalun.1688.com,b2b-3994928121ff115,¥185.80,2018卫衣男冬季加绒加厚连帽卫衣套装男士运动服金丝绒韩版男装潮
仙游县鲤南飞圣百货店,https://shop871b58754d1o2.1688.com,b2b-2200738824673ce05d,¥186.53,运动套装男春秋季圆领卫衣两件套休闲帅气一套衣服男青年潮流秋装
石狮市美舒缘服装厂,https://shop910174h7623y5.1688.com,b2b-41395151073797f,¥187.00,男士卫衣二件套装潮流韩版秋冬季金丝绒休闲运动加绒加厚保暖外套
丹阳市开发区淳贞百货商行,https://shop816600ni150n6.1688.com,b2b-2200737369802f7661,¥187.17,/2018秋冬弹力户外卫衣男圆领新品运动棉长袖335641
临漳县章里集乡珍珍网店,https://shop35642962n2808.1688.com,b2b-220123602168727c06,¥187.56,马克珍妮女童童装男春装儿童运动套装婴儿宝宝卫衣套装82103
深圳市罗玛服装有限公司,https://shop70660f5824683.1688.com,b2b-4260323878ceba9,¥188.00,长袖t恤男圆领春季青中年男士卫衣男春秋款男装韩版上衣潮T恤批发
深圳市龙岗区睿丽尔服装商行,https://shop9818380mk2754.1688.com,b2b-33833965808db47,¥188.00,长袖t恤男圆领春季青中年男士卫衣男春秋款男装韩版上衣潮T恤批发
桐乡恒企服饰有限公司,https://shop1491498679794.1688.com,b2b-322027620035337,¥188.00,2019男装春季新款全棉拼色连帽卫衣男式休闲青年开衫一件代发2583
杭州墨麦客贸易有限公司,https://shop1407268173566.1688.com,b2b-2193999871,¥188.00,墨麦客男装2019春夏新款男士连帽卫衣 运动版拼色开衫外套男2583
深圳市宝安区男城衣街服饰批发商行,https://shop1477413779949.1688.com,b2b-301834390718f61,¥188.00,花公子2019新款卫衣男运动圆领春季韩版潮流学生修身套头男士套装
石狮市枫雪依服饰贸易有限公司,https://shop2258r38855x45.1688.com,b2b-4260701526f7a19,¥188.00,卫衣套装男秋冬金丝绒运动套装男加绒加厚保暖休闲三件套运动装潮
石狮市龙都森林服装厂,https://shop27539393p3344.1688.com,b2b-383752289539da2,¥188.00,冬季金丝绒卫衣男套装潮流韩版春秋季男士外套冬装三件套厂家直销
石狮市唧唧布克服装厂,https://shop1456406196045.1688.com,b2b-278512714953a43,¥188.00,金丝绒三件套装运动卫衣男士休闲套装冬季加绒衣服外套一件代发
广州焯耀服饰有限公司,https://vertice.1688.com,b2b-336166567813adc,¥188.00,2018秋冬新品 RO DS系列新款人像贴布刺绣标男款抓绒套头长袖卫衣
深圳市福洋瑞杰服装有限公司,https://shop46s48826t0g18.1688.com,b2b-347080518786f2f,¥188.00,一件代发卫衣男2018秋季新款潮牌休闲男士卫衣字母印花圆领T恤衫
湘阴县劳保文具用品总厂,https://shop1465750972678.1688.com,b2b-2901187001c280d,¥188.00,春季卫衣男 连帽套头衫 全棉面料双层潮流街头休闲宽松外套情侣款
深圳市龙岗区华年世家服装厂,https://huanian.1688.com,b2b-29185960330a727,¥188.00,2018秋冬新品男士加绒卫衣潮款男装 日系男装加绒连帽套头卫衣
杭州古来贸易有限公司,https://shop1427820980226.1688.com,b2b-2477609639,¥188.00,2018秋季港风男士休闲外套宽松连帽运动卫衣情侣春秋新款潮流青年
石狮市黑逸白裤服装厂,https://shop1b47876v21465.1688.com,b2b-3964980555895f9,¥188.80,2018新款冬季运动套装男春秋金丝绒三件套韩版休闲服男士卫衣外套
仙游县鲤城森悦日用百货店,https://shop1x5022994a1o9.1688.com,b2b-22007387752753a3fb,¥188.87,2018春季新款外套卫衣男士连帽春秋男长袖上衣青年运动服
石狮市千张服装商行,https://shop31c2c40450u49.1688.com,b2b-335061471264c95,¥189.00,男式休闲运动卫衣套装秋季上新修身百搭外套修身跑步服青年学生服
九江市笛欧母婴产业有限公司,https://chaisang.1688.com,b2b-3879364719e0f3e,¥189.00,2019新款春秋懒鸭男装防水抗污卫衣男简约连帽套头衫免洗外套代发
泉州哲燕服饰有限公司,https://shop3o116vx582108.1688.com,b2b-40930402848f7e1,¥189.00,男式休闲套装韩版青少年加绒加厚金丝绒卫衣三件套男士运动套装
石狮市骄尔亭服装商行,https://shop8f0355l5d6736.1688.com,b2b-41070273658a7ef,¥189.00,2018秋冬新款男式休闲套装加绒加厚金丝绒卫衣三件套男士运动套装
泉州郎塑服饰有限公司,https://shop834345cbb3413.1688.com,b2b-4092981055e4c31,¥189.00,秋冬新款加绒加厚男式休闲套装金丝绒卫衣三件套男士运动休闲套装
深圳市超前服饰有限公司,https://shop1440694397058.1688.com,b2b-262906417167068,¥189.00,意邦奴秋季男士卫衣外套时尚开胸拉链套头运动服连帽卫衣中青年男
石狮市茹逸雅格服装厂,https://shop6441j971736f9.1688.com,b2b-387040204434ab4,¥189.00,2018新款秋季运动套装男跑步运动服两件套情侣运动套装连帽卫衣女
石狮市桀麟服装厂,https://shop23975z3288u96.1688.com,b2b-347128693787278,¥189.00,三件套金丝绒男式休闲套装2019新款情侣运动金丝绒卫衣潮流套装
西安市未央区白恒力百货店,https://shop5065n635k0123.1688.com,b2b-22012092623255fb79,¥189.60,特体大号男士卫衣加绒加肥加大码中国风长袖刺绣锦鲤汉服
泉州克里鲁电子商务有限公司,https://shop324n406o748j8.1688.com,b2b-4276841441e0f38,¥189.80,卫衣套装秋冬季男士休闲装韩版潮流连帽加绒冬装运动服外套两件
王江兵,https://shop0o61211991010.1688.com,b2b-3401594619c2d1b,¥190.00,2019春夏新款短袖男运动套装休闲两件套圆领T恤长裤简约时尚卫衣
清河县邵爽绒毛制品厂,https://shop401675e322e22.1688.com,b2b-40534332597d802,¥190.00,19春季卫衣套装男连帽韩版百搭版运动休闲秋两件套潮
清河县梦幻羊绒制品经销处,https://shop2n72w320492n4.1688.com,b2b-3573471627855a1,¥190.00,19春季卫衣套装男连帽韩版百搭版运动休闲秋两件套潮
北京帝鲨服装服饰有限公司,https://dsshop.1688.com,b2b-1990836935,¥190.00,大码男装2019春新款宽松套头男士休闲套装加肥加大运动卫衣两件套
海门市卓尔制衣厂,https://shop1495558517035.1688.com,b2b-3301627964a56dd,¥190.00,金丝绒卫衣套装男冬季加绒三件套潮流休闲运动冬款外套金丝绒三件
石狮市云际服装厂,https://shop1464628168667.1688.com,b2b-2899235851dfcd1,¥190.00,男士休闲装套装男金丝绒卫衣三件套装冬季潮流加绒秋冬装2019新款
石狮市蒂织服装厂,https://shop37895235o2139.1688.com,b2b-3954866121d928d,¥190.00,男式休闲套装金丝绒三件套男冬季加厚加绒青年运动时尚卫衣马甲套
泉州市淘乐电子商务有限公司,https://taolesport.1688.com,b2b-26942945276a65d,¥190.00,特步男子卫衣2019春季新品运动时尚休闲连帽针织套头衫潮流男上衣
广州市矗磊商贸有限公司,https://chuleishangmao.1688.com,b2b-3472630228a0a39,¥190.00,2017潮牌学院风连帽卫衣 男日系个性网纱原宿风带帽潮流情侣外套
深圳市雪地狼服饰有限公司,https://xuedilangfushi.1688.com,fengchifushi,¥190.00,2017秋季新品男士休闲套装卫衣潮流大牌男装男式卫衣套装微信供货
石狮市劲恒服装厂,https://shop1461085130469.1688.com,b2b-28633479007bd74,¥190.00,男士休闲装套装男金丝绒卫衣三件套装冬季潮流加绒秋冬装2018新款
莆田市荔城区伟煌鞋服商行,https://shop9851815g9g517.1688.com,b2b-393108665312540,¥190.00,2018冬季男式套装金丝绒三件套韩版休闲服男士卫衣男装束脚长裤
通州区兴仁镇萱顿服装厂,https://szjsfashion.1688.com,b2b-3904928847756c5,¥190.00,2018秋冬男装青少年连帽卫衣套装男士休闲运动潮流帅气两件套
石狮市戈扣服装厂,https://shop17r94n8875866.1688.com,b2b-393515630389742,¥190.00,一件发潮流套装男2017秋季韩版男装圆领几何印花卫衣 束脚长裤两
仙游县鲤城森悦日用百货店,https://shop2nu38075281l2.1688.com,b2b-220060381012574a03,¥190.39,春秋季套装男士卫衣运动休闲两件套韩版潮流帅气一套衣服男装秋装
厦门广太贸易有限公司,https://xmguangtai.1688.com,b2b-290462271566ac2,¥190.52,2018外套春秋季男装套装卫衣男士休闲装运动服新款青年秋天的衣。
仙游县鲤城九桥日用百货店,https://shop359r361a11b01.1688.com,b2b-2200738466658266cb,¥190.82,200斤外套套头修身金丝绒秋季加肥男士连帽韩版卫衣潮男装肥仔
仙游县枫亭美河百货店,https://shop580082759jp68.1688.com,b2b-2200731999698572dc,¥190.87,六色纯棉连帽卫衣男潮流 百搭宽松秋装男上衣 秋季加绒基本款。
上海瑞珐服饰有限公司,https://rtwqijiandian.1688.com,b2b-39797902423e6f7,¥191.00,rtw童装2019春季新款男童套头连帽休闲卫衣RKBY83165
厦门舟淘佳创电子商务有限公司,https://shop15807u3941o67.1688.com,b2b-22012110697716cc05,¥192.00,特大肥佬无扣外套 胖子加肥加大码翻领保暖绒开衫男卫衣冬季300斤
泗洪县天蝎座服装店,https://shop924t9991608j8.1688.com,b2b-22007182667267be46,¥192.00,2019春季新品男式时尚卫衣套装薄款修身圆领休闲青年潮流男装卫衣
仙游县郊尾镇精喜日用品店,https://shop8a08048uu6669.1688.com,b2b-220073208774300f2c,¥192.16,大码运动套装男秋装长袖长裤运动服休闲卫衣加肥加大肥佬宽松衣服
润州区坤资营贸易商行,https://shop58p0w469f1823.1688.com,b2b-2201205682036e0872,¥192.40,男童套装春款男孩儿童装卫衣运动三件套潮中大童帅气2019新款韩版
深圳市龙岗区招盈电子商务商行,https://shop0up1b90993009.1688.com,b2b-42462009726d835,¥192.44,秋季九分卫衣男士韩版潮流休闲运动套装秋天帅气长袖裤一整套衣服
深圳市福田区昌盛源服饰商行,https://shop238x968v3z886.1688.com,b2b-2200716661995a652f,¥193.00,2019新款外贸热秋冬潮牌卫衣泼墨嘻哈宗教条纹帽衫连帽棒球卫衣男
乐清市有有服装厂,https://lqyouyou.1688.com,b2b-22005907070131fd22,¥193.00,2019春季新款潮款卫衣男时尚街头卫衣套装男装同款情侣装全棉套装
润州区艳亚理贸易商行,https://shop6b364914596c7.1688.com,b2b-2201054433691f72db,¥193.70,运动帅气男韩版潮流三件套春季薄款卫衣外套学生套装一套衣服春秋
石狮市稻稷流昂网络服装商行,https://shop5e81002c4u358.1688.com,b2b-2200577417951ba61c,¥193.80,12秋装打底衫外套新款卫衣男秋衣服男士长袖t恤韩版青年秋季上衣
丽水市巨运来贸易商行,https://shop8n44290096625.1688.com,b2b-2200803154392d5ebe,¥194.07,三四五六年级初一男生衣服儿童装2018新款春装卫衣十岁男孩套装潮
仙游县枫亭非芃品百货店,https://shop3d48r69840914.1688.com,b2b-2200732656014d8e15,¥194.17,秋季男士套装春秋迷彩卫衣大码休闲服宽松胖子两件套
仙游县鲤南镇峰峦百货商行,https://shop83r2687m3m503.1688.com,b2b-2200716214017eb88d,¥194.50,三件套春秋运动服男新款连帽跑步运动衣2018套装女休闲情侣卫衣棉
石狮市领程服装厂,https://shop4i3704207wf57.1688.com,b2b-2200565346072df971,¥195.00,2018冬季男士韩版潮流金丝绒套装春秋大码外套男士卫衣三件套
东莞市天外红颜服饰有限公司,https://8090city.1688.com,b2b-2349649342,¥195.00,原版男款卫衣欧版宽松嘻哈偏大全棉加厚毛巾底套头卫衣LOGO印花
义乌市鸿迅生物科技有限公司,https://ywhxnz.1688.com,b2b-3355546836ed33d,¥195.00,吴亦凡同款ambush脏辫连帽卫衣男 中国新说唱 彩色抽绳情侣帽衫男
石狮市蓝壹诚服装厂,https://lanyichengfushi.1688.com,b2b-3946585001e83ac,¥195.00,2018男式休闲套装韩版时尚潮流运动金丝绒连帽卫衣加厚保暖三件套
深圳市煊恋服饰有限公司,https://shop8699q61w57419.1688.com,b2b-34141500989dab6,¥195.00,2018新款3D印花 卫衣油画长袖圆领卫衣 时尚大方卫衣厂家直销
淮安市巴斯特服饰有限公司,https://shop1434041965927.1688.com,b2b-2545069295r5ifg,¥195.00,2016款---肯迪鲨鱼男士立领夹克卫衣套装外套纯棉休闲夹克衫刺绣
