comp_name,href,memberid,price,pro_name
杭州傲都服饰有限公司,https://shop6317m9993m0m7.1688.com,b2b-4205116582b4a7e,¥155.00,厂家批发男士加绒卫衣套装青年时尚条纹个性学生连帽两件套品质
石狮市马冀骥服装厂,https://majiji.1688.com,b2b-2830280876928fc,¥155.00,金丝绒卫衣套装秋冬季三件套运动休闲装韩版潮流加绒男士外套衣服
石狮市锦绣佳礼服饰有限公司,https://jinxiujiali.1688.com,b2b-30259245255fcf6,¥155.00,男式休闲卫衣套装男2018冬季加厚加绒连帽休闲套装 厂家直销
泉州市维界贸易有限公司,https://momosheng.1688.com,b2b-4028658436353a4,¥155.00,卫衣套装男士秋冬款青少年初中学生加绒厚潮流连帽运动休闲三件套
南昌雅博贸易有限公司,https://nengbowen.1688.com,b2b-2185713942,¥155.00,花花公子男装秋冬连帽卫衣纯色加绒加厚T恤韩版潮流休闲时尚套装
成华区方伟杰礼品经营部,https://supremeplan.1688.com,b2b-38426843517e377,¥155.00,Palace reverso hood双面两面穿帽衫男加厚oversize宽松卫衣女潮
广州市庶品服装有限责任公司,https://shop1476377221389.1688.com,b2b-3009551239b5bf6,¥155.00,ins超火Palace reverso hood双面穿三角印花连帽卫衣女情侣帽衫男
深圳市罗湖区依伊美轩服装商行,https://shop3649qi4279054.1688.com,b2b-34640650165c0e4,¥155.00,花公子2018春秋卫衣男款长袖T恤男士圆领中老年打底衫爸爸装上衣
中山市沙溪镇鸿悦制衣厂,https://shop1421081094478.1688.com,b2b-2229048772,¥155.00,2018秋冬新款男女同款连帽卫衣男百搭纯色长袖半拉链情侣款外套
天津市滨海新区原单尚品服装店,https://shop56o45a303n812.1688.com,b2b-38429638682f38f,¥155.00,代工厂出品男士基础款纯色美利奴羊毛打底上衣卫衣
石狮千宇服饰有限公司,https://fjqianyu.1688.com,b2b-1710862313,¥155.00,金丝绒立领拉链男士卫衣运动情侣运动套装男士卫衣长袖加绒版套装
深圳市朵韵科技有限公司,https://shop44y36u722r047.1688.com,b2b-3537602474560d7,¥155.00,欧洲站连帽卫衣男秋装新款皇冠人物帽衫重工刺绣花卉套头长袖上衣
石狮市潮韩靓仔服饰有限公司,https://88811111.1688.com,b2b-1771302547,¥155.00,冬季金丝绒卫衣男装秋装韩版潮流套装春秋季外套男士秋冬装三件套
秦皇岛市同金商贸有限公司,https://shop1414667079107.1688.com,b2b-2303957941,¥155.00,男卫衣连帽加肥加大码男装运动外套秋冬款开衫外衣特体肥佬胖子款
深圳市宝安区松岗慕森狼服饰加工厂,https://shop1414170621641.1688.com,b2b-2270615032,¥155.00,2018卫衣套装男秋季国潮大码宽松l连帽上衣男士中国风刺绣男外套
即墨区道岭服装厂,https://shop12895p04144l2.1688.com,b2b-300010753835f10,¥155.00,卫衣男春秋款圆领套头运动两件套韩版潮流休闲装秋季男士卫衣套装
杭州默啜贸易有限公司,https://givemhome.1688.com,b2b-2136458354,¥155.00,卫衣套装男士春秋韩版潮流休闲运动服秋季圆领外套印花长袖两件套
杭州帅虎贸易有限公司,https://SAGELIZARD.1688.com,johny723,¥155.00,中国风大码男装男士卫衣国潮胖子连帽套头衫加肥加大宽松肥佬套装
上海位源商贸有限公司,https://shop1446202678481.1688.com,b2b-26912521542f6b9,¥155.00,运动套装男春秋季圆领卫衣两件套休闲帅气套装衣服男青年潮流秋装
石狮市码度服装商行,https://haijiexiao.1688.com,b2b-2190137966,¥155.00,冬季卫衣连帽外套男三件套修身加绒加厚休闲青少年撞色拉链运动装
周昌仁,https://shop1427388520208.1688.com,b2b-2468986564,¥155.00,2018秋季新款男士韩版修身中国风美女印花潮大码青年长袖卫衣套装
石狮市野阵吉普服装厂,https://shop1463418024620.1688.com,b2b-2880875443cc8ac,¥155.00,男装秋冬新款男士卫衣厚款三件套连帽青年男外套定制批发一件代发
杭州轰诺服饰有限公司,https://shop1481043653510.1688.com,b2b-3062919016d36ed,¥155.00,卫衣男圆领韩版潮流学生春秋印花套头帽衫男士韩版套装运动外套
苏州潮趴电子商务有限公司,https://blackstore.1688.com,b2b-306531225360bf5,¥155.00,2018秋款 原宿日系男士立领卫衣运动套装青少年秋装卫衣整套出售
管飞飞,https://shop1396371439842.1688.com,b2b-2041554348,¥155.00,2018原单男装新款套头卫衣 男士圆领韩版秋衣休闲长袖外穿T恤潮流
石狮市东祥服饰有限公司,https://adtass.1688.com,b2b-1664399130,¥155.00,2018年春季新款男士卫衣休闲套装10530配10611上衣裤子整套
杨仕富,https://shop1430326315024.1688.com,b2b-2510681525,¥155.00,2018日系春装新款连帽卫衣运动套装青年学生男士外套TZ41一件代发
石狮市竞赛迩贸易有限公司,https://jingsaier.1688.com,b2b-260373787008417,¥155.00,新款秋冬季加厚卫衣套装男士运动套装加绒保暖纯棉连帽跑步运动服
长沙杰克龙服饰贸易有限公司,https://jiekelongfushi.1688.com,b2b-2977728569748ad,¥155.00,新款秋冬季运动套装男士加绒加厚卫衣套装保暖纯棉连帽跑步运动服
杭州衣雄汇服饰有限公司,https://weke1987.1688.com,b2b-1888606395,¥155.00,冬装男士新款加绒个性卫衣套装时尚个性加厚保暖连帽休闲套装男式
石狮市高世炎服装商行,https://15396600011.1688.com,b2b-2000759561,¥155.00,秋冬新款男士卫衣  休闲金丝绒加厚套装 青少年学生运动三件套
萍乡市安源区鹏翔服饰批发商行,https://shop1375117098470.1688.com,b2b-1764286689,¥155.00,2018春秋季新款男装潮拉链修身外套男式圆领套头卫衣套装男两件套
石狮市凯迪达斯服装厂,https://shop1460998245602.1688.com,b2b-2861839650c8daf,¥155.00,秋冬新款男士休闲开衫运动两件套加绒加厚连帽卫衣套装男式运动服
石狮市英朗服装厂,https://ssylfashion.1688.com,b2b-390169297476f00,¥155.00,冬季潮流韩版连帽金丝绒男士秋冬款衣服三件学生外套加绒卫衣套装
武汉市硚口区依赖时尚潮流服饰商行,https://shuangbao0702.1688.com,b2b-2077550536,¥155.00,卫衣男士长袖T恤2018春秋新款中年青年潮流休闲运动衣服秋天套装
德化县豪晖哲服服装批发商行,https://shop120h74t953296.1688.com,b2b-39267218260e3f4,¥155.00,直销一件代发 春季新款男士套头连帽卫衣日系渐变宽松扎染帽衫外
润州区举之华百货商行,https://shop30s3m53s81532.1688.com,b2b-220077420503313f9d,¥155.01,秋冬男士开衫毛衣卫衣男纯色针织衫外套男开衫棒球领修身大码潮
庆安县阿峰办公用品店,https://shop7031v03l48a14.1688.com,b2b-22007872686687e522,¥155.28,香港潮牌2019春季半拉链高领卫衣男时尚ins抖音打底衫潮男韩版百
深圳市南山区翠娥雨贸易商行,https://shop3w05x9w570496.1688.com,b2b-2200728300840cf1af,¥155.32,2019新款夹克男春秋外套 印花连帽卫衣 学生修身棒球服运动装
润州区南之怀百货商行,https://shop5i416599846m0.1688.com,b2b-2200725903034249fe,¥155.35,学生灌篮高手外套男卫衣青少年动漫开衫棒球服加绒衣服潮
仙游县枫亭美河百货店,https://shop46328dt507199.1688.com,b2b-22007318899516cf35,¥155.40,优美秋冬季男士加绒加厚款卫衣外套宽松加肥加大码中年高领运动服
仙游县枫亭鑫泉百货店,https://shop24560bo4142p6.1688.com,b2b-22007323272273ef81,¥155.40,优美卫衣套装男韩版潮流连帽两件套2018新款春秋季中学生帅气一套
石狮市神咖贸易有限公司,https://shop1430413544344.1688.com,b2b-2516106116,¥155.82,2018金丝绒运动服套装两件套秋冬休闲连帽套装男士外套卫衣男装潮
莆田市城厢区开果服装店,https://shop4418919rw27d2.1688.com,b2b-22007785532921e000,¥155.90,香港潮牌2019春夏季男士t恤长袖卫衣圆领韩版潮流打底衫衣服男装
莆田市荔城区广妃贸易有限公司,https://shop3460gmw356279.1688.com,b2b-2200630911286b7a86,¥156.00,卫衣套装男2019春季新款口袋装饰休闲运动套装纯色韩版潮流两件套
莆田市湄洲湾北岸经济开发区山亭金运服饰商行,https://shop14705h72730j9.1688.com,b2b-2200787847386a311c,¥156.00,男式加绒卫衣18男装秋装新款中国卫衣开衫夹克卫衣立领休闲男外套
石狮市驰杰电子商务有限公司,https://shop6644406937u16.1688.com,b2b-22007728033241da9c,¥156.00,吉普盾男装春秋款半拉链卫衣 男商务休闲宽松长袖t恤男立领上衣服
深圳市龙华新区潮韩社服装厂,https://shop26169107536x2.1688.com,b2b-220073563864831a46,¥156.00,19优品潮牌个性骷髅头开衫连帽卫衣男猿人头双面穿风衣迷彩黑卫衣
常山县一忉服装商行,https://shop40678p1p36p05.1688.com,b2b-22007275045443b039,¥156.00,春秋季潮流运动服套装男士潮流全棉套头连帽印花卫衣学生休闲外套
丹阳市开发区拓远达百货商行,https://shop9436519991c46.1688.com,b2b-2200725409530f2c11,¥156.00,卫衣套装男2019春季新款加绒连帽休闲运动套装情侣韩版潮流两件套
上海乾迈国际贸易有限公司,https://topway2018.1688.com,b2b-4050882751afdea,¥156.00,2019春夏新款深灰色薄款欧美原单男士长袖连帽卫衣 SM0004AS
石狮市梦发发服装商行,https://shop721p960934gd3.1688.com,b2b-42895501796bbaf,¥156.00,运动套装男金丝绒加绒三件套新款秋冬季韩版潮款冬装连帽卫衣马夹
成华区苏天荷服装商行,https://shop8667z210tl638.1688.com,b2b-424577289511af9,¥156.00,2018卫衣男连帽秋季加绒加厚男士修身款韩版纯棉大码运动潮新款式
周口汤瑾电子商务有限公司,https://imopin.1688.com,b2b-41376276747f62c,¥156.00,春季卫衣男士薄款外套青少年学生休闲连帽上衣一件代发
瑞安市布希电子商务商行,https://shop1466960617999.1688.com,b2b-2912181845b98d8,¥156.00,2018冬季加绒加厚男式休闲套装金丝绒运动卫衣三件套外套保暖男装
杭州沭鲲服饰有限公司,https://shop9945983498698.1688.com,b2b-3975056689ab72d,¥156.00,18秋冬季新款男士休闲青少年宽松韩版衣服加绒保暖连帽卫衣男装
杭州新嘉境贸易有限公司,https://puduoyi.1688.com,tangjianfang88,¥156.00,男童冬装三件套奕时代胖儿童宽松加厚保暖中大童卫衣套装加绒连帽
润州区片之年百货商行,https://shop6131009f72806.1688.com,b2b-2200578676377d4613,¥159.00,金丝绒卫衣男冬季连帽运动套装女加绒加厚韩版学生字母情侣两件套
揭阳市揭东区新亨镇领跑服饰网店,https://13427390088.1688.com,b2b-2130482393,¥159.00,2018秋冬季长袖T恤男士韩版秋衣服打底衫衬衫领针织小衫卫衣男潮
深圳市南山区水尚品卫浴厂,https://shop1468581942803.1688.com,b2b-2929173894c1227,¥159.00,冬季男士连帽学生外套加绒加厚 潮流情侣长袖宽松bf风冬装卫衣 版
石狮市本盛服装厂,https://shop773650t231z20.1688.com,b2b-35857906553f47f,¥159.00,2018冬季新款休闲运动套装男卫衣青年个性潮加绒加厚学生外套男装
深圳市艾迈服饰有限公司,https://ebe168.1688.com,ebe99,¥159.00,卫衣套装秋季男士连帽春秋款两件套休闲装秋冬加绒加厚潮流运动服
广州强袭出击贸易有限公司,https://maxattack.1688.com,b2b-32537844978883d,¥159.00,MAXATTACK双杠条纹长袖运运卫衣男 高弹速干透气健身服篮球外套
石狮市喆跃服装厂,https://shop2700n42300f57.1688.com,b2b-3407209099c4a5d,¥159.00,2018冬季新款休闲运动套装男卫衣青年个性潮加绒加厚学生外套男装
石狮市蓝湾飞羽服装厂,https://shop1495731332198.1688.com,b2b-3307066735d0bbc,¥159.00,2018秋冬休闲运动套装男卫衣青年个性潮加绒加厚学生外套男装批发
石狮市好衣时时穿服饰有限公司,https://shop1493311925217.1688.com,b2b-32616666433077c,¥159.00,冬季青少年卫衣男加厚加绒冬季休闲运动套装韩版潮马甲三件套外套
深圳市宝安区新安衣加一服饰商行,https://shop1495685552339.1688.com,b2b-3308237244e5758,¥159.00,秋冬季卫衣男士连帽套头韩版潮流加绒加厚金丝绒上衣学生休闲外套
深圳市南山区心创馨服饰商行,https://shop1466681447049.1688.com,b2b-2919661849bb96a,¥159.00,秋冬季卫衣男士连帽套头韩版潮流加绒加厚金丝绒上衣学生休闲外套
江阴市彩展贸易有限公司,https://shop1w53883791312.1688.com,b2b-357372528258b70,¥159.00,恒源祥连帽卫衣男士套头2018新款男装帽衫韩版修身潮流春秋外套
石狮市鑫驰特服装厂,https://shop7358832f95197.1688.com,b2b-3843944334bc666,¥159.00,2018金丝绒运动服套装两件套秋冬休闲连帽套装男士外套卫衣男装潮
青岛名衣库贸易有限公司,https://mingyikufushi.1688.com,b2b-2005643314,¥159.00,加绒加厚卫衣 男开衫连帽羊羔绒青年冬季秋季中年中老年保暖外套
义乌市领斯服装厂,https://shop251d64b941171.1688.com,b2b-3842908902c17f5,¥159.00,冬季加绒加厚套头卫衣青少年学生连帽衫原创休闲韩版宽松男装
义乌市莫芎电子商务有限公司,https://shop1448557561201.1688.com,b2b-272558101232ff6,¥159.00,FOG第五季高街秋冬新双向拉链羊羔绒棉衣连帽卫衣外套加厚加绒男
青岛龙仕达体育用品有限公司,https://qingdaolongshida.1688.com,b2b-1675650911,¥159.00,龙仕达男士运动外套立领上衣针织休闲宽松夹克卫衣春秋款纯色开衫
润州区云之关百货商行,https://shop1317019f47x14.1688.com,b2b-22007263615238e6c0,¥159.70,2019套装休闲运动冬季男士加绒加厚连帽卫衣男韩版三件套冬装外套
深圳市光明区季节风百货商行,https://shop6o1r3960m1598.1688.com,b2b-42172545370950c,¥159.76,1春装2男童3卫衣裤子三件套装6儿童装5春秋季小男孩衣服4岁春天潮
珠海中之吉贸易有限公司,https://shop42832u99328p4.1688.com,b2b-417051788855740,¥159.80,秋冬男士宽松休闲运动全棉跑步卫衣外套时尚修身个性潮流连帽套装
黄陂区千百鑫服饰店,https://shop53117026b6l79.1688.com,b2b-2201256138372ef871,¥160.00,春秋季中年运动套装男中老年大码休闲运动服三件套爸爸装卫衣套装
杭州南夏乔装服饰有限公司,https://nxqzh888.1688.com,b2b-401618500043df5,¥160.00,FORN3 秋季新款卫衣男日系复古宽松连帽套头上衣变形背包外套男
西安永靓服饰有限责任公司,https://xgj1188.1688.com,xgj1188,¥160.00,2019夏季韩版连帽短袖T恤男士卫衣带帽宽松五分中袖潮流卫衣
崇川区周阳春服装经营部,https://achunfushi.1688.com,b2b-1788183970,¥160.00,【金洋船】春季新款两件套男韩版外套长袖运动服青年休闲卫衣套装
沁水县悦心服饰贸易有限公司,https://shop270522w7w4e98.1688.com,b2b-22007547961914eb70,¥160.00,春秋新款外搭连帽印花卫衣男潮牌韩版薄款青年学生帅气休闲外套
深圳市龙岗区君悦行制衣厂,https://junyue318.1688.com,b2b-2875937965711ae,¥160.00,春夏新款卫衣男原创潮牌迷彩拼色拉链 纯棉情侣卫衣一件代发
莆田市城厢区吴乔乔鞋服店,https://shop10d1426937044.1688.com,b2b-220069356142829e5e,¥160.00,春秋男式休闲卫衣运动套装男情侣修身 欣欣268652
莆田市涵江区杰哥鞋服店,https://shop8921k75x875x7.1688.com,b2b-220076539005224936,¥160.00,男士t恤短袖男卫衣圆领2019春秋新款韩版潮流学生春季打底衫05
揭阳市华恒网络科技有限公司,https://shop1409965765098.1688.com,b2b-2232738228,¥160.00,2019春季新款男士字母印花连帽套头卫衣ZX-WY10
东莞市大朗濠鑫服装批发部,https://shop1459961048201.1688.com,b2b-2828178836ed6ac,¥160.00,（厂家）定制批发薄款时尚运动连帽羊毛衫男款修身卫衣男bts卫衣
上海臻酷电子商务有限公司,https://kaluren.1688.com,b2b-2586252593b797d,¥160.00,品牌男装批发中国风印花白色休闲套装男两件套春秋装男式卫衣套装
石狮市登陆吉普吉服饰有限公司,https://shop1475919661716.1688.com,b2b-3006923684422b2,¥160.00,男装秋冬季运动户外抓绒衣三件套保暖纯色潮流双面绒男士卫衣套装
郑州市二七区迈威鞋服商行,https://shop05978497c25y8.1688.com,b2b-425796389994a17,¥160.00,FL2019春季新款男士运动休闲连帽套装 卫衣+卫裤套装 二件套
石狮市阿龙服装商行,https://shop4803196o4p6z9.1688.com,b2b-220072720461637b9e,¥160.00,男士休闲运动套装2018新款金丝绒卫衣卫裤马甲三件套潮
南浔植棉服装店,https://shop02550yv141b18.1688.com,b2b-3999536963eef1b,¥160.00,2019年春季新款男童二件套中大童休闲套装时尚潮范卫衣两件套批发
苏州大热水电子商务有限公司,https://dareshuifushi.1688.com,b2b-3694704397472a5,¥160.00,【金洋船】春季新款两件套男韩版外套长袖运动服青年休闲卫衣套装
城阳区胡筱姝服饰批发部,https://shop1494900771700.1688.com,b2b-3260715323cb4a3,¥160.00,19年春夏新款空气棉男士卫衣 两种胸前搞怪印花 一件代发
深圳市龙岗区中力跃服装厂,https://shop643814759ryr5.1688.com,b2b-41707529417350c,¥160.00,NBA出场服湖人队詹姆斯勇士队火箭队热身服投篮服连帽衫卫衣外套
即墨区戎美服装厂,https://rongmeifzc.1688.com,b2b-4164177416f08cb,¥160.00,厂家直销春秋男式休闲卫衣 纯色连帽长袖外套青少年日常时尚修身
义乌市墨弈服饰厂,https://shop8938a1r922b87.1688.com,b2b-396280412755cce,¥160.00,MOYI墨弈原创日系潮牌2019春款个性可变形夹克卫衣套头潮ZX-WY09
温州雷思度服饰有限公司,https://leisidufushi.1688.com,b2b-3681325468d4425,¥160.00,2018秋冬新款卫衣男圆领打底衫长袖加绒加厚日系男装磨毛男打底衫
润州区扬宁百货商行,https://shop4r11rn5926483.1688.com,b2b-22005651278138bf24,¥160.00,大码男装宽松休闲卫衣长袖立领开衫2018春季新款男士胖子运动套装
即墨市衣邦人服饰厂,https://shop62467yk902700.1688.com,b2b-3417832760b7f4d,¥160.00,19春季新款  男士立领拉链拼接撞色刺绣运动休闲健身卫衣卫裤套装
周口梦翼商贸有限公司,https://mysm2018.1688.com,b2b-4118922293866c7,¥160.00,花花公子男士卫衣2019韩版春装运动外套学生修身长袖连帽套头上衣
杭州凯众服饰有限公司,https://shop1100t44dl8292.1688.com,b2b-422833521735e30,¥160.00,KAIZ 凯众2019春装新款日系原创潮牌男个性可变形夹克卫衣潮WY09
新会区会城洪顺服装店,https://razahm1.1688.com,b2b-3164622001e10d5,¥160.00,男子运动休闲抓绒保暖卫衣套装衣裤 户外新款健身训练加绒套装
石狮市牧奴高服装厂,https://shop1458061184932.1688.com,b2b-2830453645330ed,¥160.00,2018新款男秋冬新款户外运动休闲三件套加绒加厚保暖卫衣套装8589
上海韵朗服饰有限公司,https://shop7804381b62l73.1688.com,b2b-220057765770460a14,¥160.00,2019男士秋冬款休闲运动套装新款金丝绒卫衣卫裤马甲三件套潮2680
晋江市陈埭镇龙思服装厂,https://shop6829t1k232341.1688.com,b2b-2200607453442c50fe,¥160.00,2019男春秋新款开衫卫衣男风衣运动休闲型上衣连帽青年夹克外套潮
广州前潮服饰有限公司,https://shop11801a30265t4.1688.com,b2b-4145824324b2b70,¥160.00,新款男装潮牌男士休闲迷彩加绒拉链外套中长款加厚运动连帽卫衣
广州欧霏莱贸易有限公司,https://shop1429936120676.1688.com,b2b-2474263975,¥160.00,2019年春秋新款男式休闲连帽卫衣套装纯色百搭潮男运动长袖两件套
桐乡市濮院海盈服装厂,https://haiying2.1688.com,b2b-29244163779c8c9,¥160.00,加绒加厚男士卫衣卫裤运动套装加肥加大码连帽两件套保暖冬装拼色
即墨区良源尚品服装厂,https://shop873u223888867.1688.com,b2b-4040373901131af,¥160.00,男士秋冬款AD家加厚水貂绒套装 韩版运动休闲打底卫衣卫裤两件套
石狮市现代雄风服装店,https://xdxfmall3.1688.com,b2b-1662431545,¥160.00,2681男士秋冬款休闲运动套装2018新款金丝绒卫衣卫裤马甲三件套潮
深圳市宝安区新安欧迈克制衣厂,https://shop1393260885888.1688.com,b2b-1988864431,¥160.00,运动套装男秋冬2018新款加绒加厚连帽卫衣保暖休闲运动套装两件套
石狮市冉诚帝释服装厂,https://shop833pw88039s33.1688.com,b2b-3905487494a670b,¥160.00,冬季金丝绒运动服套装两件套男士加绒加厚休闲连帽卫衣男装外套潮
渝中区戈盾服装经营部,https://shop665237sw44600.1688.com,b2b-4264689296ece18,¥160.00,2018年新款式男士卫衣 时尚潮流 1620货号
杭州昊顺服饰有限公司,https://shop18851148i2g36.1688.com,b2b-4057512108b3fb6,¥160.00,金丝绒卫衣三件套男士连帽冬季加绒加厚外套韩版潮流休闲运动套装
石狮市现代雄风服装店,https://xdxfmall.1688.com,b2b-1662470985,¥160.00,2665冬季金丝绒休闲套装青年保暖三件套时尚男士运动套装加厚卫衣
广州旭春贸易有限公司,https://shop577hj97168i32.1688.com,b2b-42095100796a4df,¥160.00,看东方自主牌秋冬连帽卫衣男童女童外套纯色套头长袖上衣高端定制
石狮市酷杰之家贸易有限公司,https://shop1487321551779.1688.com,b2b-316690597208d4e,¥160.00,2018男士秋冬款休闲运动套装新款金丝绒卫衣卫裤马甲三件套潮2680
德兴市新岗山镇荣成服装制衣厂,https://shop902l568319ii3.1688.com,b2b-41326393063148c,¥160.00,2018新款时尚男装金丝绒卫衣马甲三件套男冬季加厚保暖卫衣男套装
杭州巧思服饰有限公司,https://shop45391rnm27376.1688.com,b2b-36885957060549f,¥160.00,青少年冬季套装双面金丝绒三件套韩版休闲服男士卫衣新款一件代发
杭州佐创电子商务有限公司,https://shop8898i14z70s63.1688.com,b2b-3842492585dc008,¥160.00,2018冬季新款卫衣套装修身连帽加绒加厚蝴蝶刺绣男运动休闲三件套
深圳市鑫泰都国际贸易有限公司,https://shop1467095062572.1688.com,b2b-292099248182362,¥160.00,批发ow  拉链套头连帽卫衣女男学同款生
海门市酷典服饰厂,https://shop45c42h1d61815.1688.com,b2b-3936943563e0de5,¥160.00,男士卫衣冬季运动套装加绒加厚连帽三件套 学生休闲装外套潮
海门市巧倩服装厂,https://shop1470847905741.1688.com,b2b-2962871035e2af3,¥160.00,秋冬迷彩运动夹克男外套加肥加大码宽松连帽休闲上衣胖子男装卫衣
浙江柳恩儿贸易有限公司,https://shop3h1514th46116.1688.com,b2b-4153290368f91e0,¥160.00,正确版AMBUSH脏辫帽衫卫衣 中国新说唱王源吴亦凡同款嘻哈潮流男
深圳市宝安区阿拉丁服饰商行,https://shop8566h80d11203.1688.com,b2b-41210238293331a,¥160.00,秋冬新款韩版男女式长袖休闲运动卫衣套装 灰色情侣套装
深圳市宝安区西乡津沢服装商行,https://championbape.1688.com,b2b-393298380573d91,¥160.00,日系男装连帽开衫男女情侣大码卫衣街头潮牌一件代发外贸新款
石狮市金世达服装厂,https://sskst1688.1688.com,b2b-324403086735e3b,¥160.00,2018冬季三件套金丝绒休闲双面绒套装男士休闲装卫衣运动韩版潮流
杭州衣卡科技有限公司,https://shop13231d69546j9.1688.com,b2b-407945230349619,¥160.00,2019男修身长袖卫衣外套俩件套男撞色斜纹长条潮男卫衣俩件套
石狮市闪酷服装厂,https://shankufz.1688.com,b2b-2176442295,¥160.00,金丝绒卫衣套装男装三件套冬季连帽加绒加厚韩版休闲运动秋冬外套
石狮市亚戈布里服装厂,https://yagebuli.1688.com,b2b-28905987108ae44,¥160.00,秋冬新款男士卫衣休闲金丝绒加厚套装青少年学生运动保暖三件套
石狮市丹辉吉普服装商行,https://danhuijipu.1688.com,b2b-2003902546,¥160.00,男装秋冬季运动户外抓绒衣三件套保暖纯色潮流双面绒男士卫衣套装
石狮市威裕隆服装商行,https://shop1458712072852.1688.com,b2b-2842155273fd7b7,¥160.00,跨境专供男秋冬新款户外运动休闲三件套加绒加厚保暖卫衣套装8589
石狮市琴意服装商行,https://shop1487264991117.1688.com,b2b-3158725104f0ba0,¥160.00,战地男秋冬新款户外运动休闲三件套加绒加厚保暖卫衣套装8589
义乌市欣宸电子商务商行,https://shop202278z263732.1688.com,b2b-400525940338add,¥160.00,2018秋冬新款韩版潮拼色连帽卫衣男士套头卫衣外套男代发外贸男装
义乌市祥旭服饰有限公司,https://xiangxufushi.1688.com,b2b-3538766804bb9b8,¥160.00,欧美高街男装FOG重磅毛圈料情侣纯色OVERSIZE宽松套头连帽卫衣男
广州富科商贸有限公司,https://fuke008.1688.com,b2b-2818259059f6b5d,¥160.00,2018秋季男士卫衣 字母印花圆领长袖衫 欧美高端高档男装一手货源
上海三羽鸽服饰有限公司,https://syg555.1688.com,syg555,¥160.00,春季新款潮男韩版男士运动套装卫衣休闲开衫大码棒球服批发定制
深圳市龙岗区京明达服饰商行,https://shop1429201302221.1688.com,b2b-2493615011,¥160.00,春季运动套装男拼色运动服休闲卫衣套装中老年加大码跑步健身春秋
上海源远实业有限公司,https://herostand.1688.com,b2b-2481187255,¥160.00,秋冬新款重磅高街GD同款吊肩OVERSIZE加厚双层卫衣双拉链外套男潮
瑞安市豹牌电子商务商行,https://aibaopai.1688.com,b2b-282756479396707,¥160.00,春季新款男装韩版修身男式卫衣套装男士休闲棒球服运动卫衣套装潮
温州肌肉战争电子商务有限公司,https://gymwars.1688.com,b2b-3295375800468ea,¥160.00,肌肉兄弟健身健美运动休闲速卖通一件代发保暖套头冲锋衣外套卫衣
广州爵尚服饰有限公司,https://wangyi881223.1688.com,b2b-325009214893dae,¥160.00,春秋季小蜜蜂刺绣卫衣套装男莫代尔撞色罗纹长袖休闲运动两件套潮
